서비스명,대분류,서비스번호,판매자,소분류
이건 될 것 같다 라고 생각이 든다면 되는 겁니다.,기타,4959.0,JumpUpSuperStar,기타
flutter 모바일 앱 제작해 드립니다.,모바일,4960.0,민더긔,앱
"flutter 기능 추가,수정,유지보수",기타,4961.0,민더긔,웹 유지보수
React 기반 웹사이트 제작 / 유지보수 / 퍼블리싱,홈페이지,4962.0,돼지엄마,웹 유지보수
고품질 반응형 홈페이지 제작 완벽한디자인 해 드립니다.,홈페이지,4965.0,홈페이지제작디플랜,웹 제작
스타트업 전문 하이브리드 앱 개발 드립니다.,모바일,4966.0,ZIPLE,앱
배달앱 주문앱을 배민처럼 깔끔한 앱을 만들어 드립니다.,모바일,4967.0,DealDeal,앱
자동 메일링 및 자동 스케쥴링 셋팅,기타,4968.0,노코드햄스터,프로그램 자동화
"PHP그누보드, CI보드 작업 해 드립니다.",프로그래밍,4969.0,남광우,기타
크로스플랫폼 앱 + 웹서버 빠르게 제작해드립니다,모바일,4970.0,제이든든,앱
긴급 보안 원격 점검을 드립니다.,기타,4971.0,bynullyLAB,정보.보안
"해킹의심, 해킹흔적조사 해 드립니다.",기타,4972.0,bynullyLAB,기타
필요한 백엔드 API 구현해 드립니다.,기타,4973.0,Flrea,직무직군
"이더리움, 폴리곤, 클레이튼 표준 토큰을 발행합니다.",기타,4974.0,StyledBlockChain,기타
직접 관리하기 쉬운 Wix 윅스 홈페이지 제작,홈페이지,4975.0,UNCODINGS,웹 제작
"데이터 스크래핑, 자동화 솔루션 개발해 드립니다.",데이터,4976.0,굿제이슨,크롤링.스크래핑
IT QA Adhoc Test 또는 결과검증서 드립니다.,기타,4977.0,김줭,기타
간단한 안드로이드 앱 개발,모바일,4978.0,서태준,앱
YOLO 학습용 데이터 라벨링해 드립니다.,데이터,4979.0,projectMoon,교육·컨설팅
"반응형 홈페이지 기획부터 디자인, 제작까지해드립니다.",홈페이지,4982.0,엔드스튜디오,웹 제작
이더리움 지갑 API 개발,프로그래밍,4984.0,keymamo,웹 유지보수
"회로 설계 , PCB Artwork, 시제품 개발해 드립니다.",프로그래밍,4985.0,mangolab,웹 유지보수
쇼핑몰 홈페이지 제작해 드립니다.,커머스,4986.0,Coworking,웹 제작
"기업/개인 홈페이지, 커뮤니티 개발 드립니다.",홈페이지,4987.0,Coworking,웹 유지보수
멋지고 유용한 홈페이지를 제작해 드립니다.,홈페이지,4988.0,어반코드,웹 제작
"주문,발주,정산,매출,재고 관리 프로그램 개발해 드립니다.",프로그램,4990.0,플랜비매니저,프로그램 유지보수
"웹 페이지 제작 HTML, CSS, JavaScript",홈페이지,4991.0,시크한너구리3850,웹 제작
복잡한 보고서 또는 관리시스템 등 엑셀 매크로로 만들어 드립니다.,데이터,4992.0,꼭필요한사람,액셀.스프레드시트
중국 J사 해외직구 데이터 수집 프로그램 개발해,데이터,4993.0,칼퇴서플라이어,크롤링.스크래핑
전문가용 분양몰 유지보수 드립니다.,기타,4994.0,분양몰전문서비스,웹 유지보수
가상계좌 API 연동 쇼핑몰 제작해 드립니다.,커머스,4995.0,Bunker22,웹 제작
바로 개발 가능한 화면설계를 해 드립니다.,프로그래밍,4996.0,zesty,웹 유지보수
"회사업무관리 ERP, MES,WMS 프로그램 개발",프로그램,4999.0,항상초심,프로그램 유지보수
단기채용 및프리랜서를 찾아 드립니다.,기타,5000.0,크몽,기타
카카오 알림톡 연동 프로그램을 만들어 드립니다.,프로그램,5001.0,가이버박,프로그램 유지보수
맞춤 Testcase 제작 해드립니다 국문/영문,프로그래밍,5002.0,박찌니,웹 제작
이러닝 교육 콘텐츠 제작해 드립니다.,프로그래밍,5003.0,상상콘텐츠,교육·컨설팅
"반응형 홈페이지 제작 전문, 사업자를 도와 드립니다.",홈페이지,5004.0,퓨처반응형,웹 제작
리액트네이티브 앱 패키징 푸시/SNS로그인/결제 연동,모바일,5005.0,SANG,앱
브랜드의 색깔을 담은 웹사이트를 제작해드립니다,홈페이지,5006.0,AgencyHEEEE,웹 제작
SSL 보안서버 인증서 설치 드립니다.,데이터,5007.0,거북이문,정보.보안
"EPUB 전자책 EPUB3,장애인접근성을 제작해 드립니다.",프로그래밍,5008.0,speeno,웹 제작
.NET C# 개발. WPF 또는 WinForms,프로그래밍,5009.0,혼살,웹 유지보수
Flutter 앱 개말 및 맞춤형 API 개발,모바일,5010.0,DevLabs,앱
큐텐Qoo10 후기 다운로드 및 관리,기타,5012.0,K460989803,기타
"개발에 SF를 더하다, 원하시는 그 모습을 계산해 드립니다.",프로그래밍,5013.0,개발의신,웹 유지보수
홈페이지 웹퍼블리싱 해드립니다.,홈페이지,5014.0,JuchKim,웹 유지보수
웹 모바일 모의해킹해 드립니다.,홈페이지,5015.0,GomPo,웹빌더
유머 커뮤니티 제작해 드립니다.,프로그래밍,5016.0,예스맨,웹 제작
게시판 댓글 쇼핑몰 DB추출 파싱해 드립니다.,커머스,5017.0,예스맨,웹 제작
"아두이노, 라즈베리, st32, 모바일 앱 제작해 드립니다.",모바일,5018.0,차은우,하드웨어·임베디드
Android iOS 모바일앱 제작해 드립니다.,모바일,5019.0,허당도사,앱
iOS 네이티브앱 유지보수해 드립니다.,모바일,5020.0,허당도사,웹 유지보수
"반응형 인터랙티브 상품 페이지, 풀스택 개발자가 개발해 드립니다.",프로그래밍,5021.0,LEANTN,웹 유지보수
책임감 있게 맡은업무 꼼꼼하게 해 드립니다.,기타,5022.0,개발이좋아,기타
웹 서비스 수정도와드립니다.,홈페이지,5023.0,개발자이든,웹빌더
코인 자동매매 프로그램 제작 해드립니다.,프로그램,5024.0,Nanago,블록체인·NFT
"Unity 2D 게임 신속, 정확하게 완성해 드립니다.",게임,5025.0,유니티쳐,게임·AR·VR
워드프레스 반응형 홈페이지 제작 드립니다.,홈페이지,5027.0,사이트메이커,웹 제작
반응형 웹페이지 제작,홈페이지,5028.0,민세,웹 제작
VMware /Linux 기술지원 및 유지보수,기타,5029.0,다각인포텍,컴퓨터 기술지원
DBMS 기술지원해 드립니다.,기타,5030.0,DB왕 봉식이,컴퓨터 기술지원
주문 제작 웹사이트 만들어 드립니다.,홈페이지,5032.0,아요밍,웹 제작
PHP 웹사이트 유지보수 및 신규개발 작업해 드립니다.,홈페이지,5033.0,웹플머,웹 유지보수
가정용 컴퓨터를 채굴기로 변신시켜 부수익 실현시켜 드립니다.,기타,5034.0,친절한컴잘알씨,하드웨어·임베디드
수익형 모바일 퀴즈 게임 개발해 드립니다.,프로그래밍,5035.0,MOCAPOT,게임·AR·VR
그누보드 템플릿을 이용한 반응형 웹사이트 만들어 드립니다.,홈페이지,5036.0,슈야,기타
"앱/웹 서비스, 빠른 에러 버그 테스트 해 드립니다.",모바일,5037.0,GreenTester,앱
"아임웹 반응형홈페이지 기획,디자인, 제작까지 해 드려요",홈페이지,5038.0,JinhanStudio,웹 제작
음식 및 물품 주문앱 + 업소홍보앱을 개발해 드립니다.,모바일,5039.0,개발천사,앱
"딥러닝, AI 개발해 드립니다.",데이터,5040.0,황코딩,웹 유지보수
카페24 등 운영 사이트 기능 수정/추가해 드립니다.,기타,5041.0,OGF,웹 유지보수
가상화폐 비트코인 자동매매 프로그램 맞춤 제작 해 드립니다.,프로그램,5042.0,HJprogram,블록체인·NFT
웹페이지 데이터 크롤링해 드립니다.,데이터,5043.0,CodeCoffee,크롤링.스크래핑
"DC, BLDC 모터 드라이버 개발 해 드립니다.",프로그래밍,5044.0,전자회로의신,웹 유지보수
"워드프레스 홈페이지,쇼핑몰,예약시스템 제작해 드립니다.",커머스,5045.0,한번해봐요,웹 제작
Unity 로 다양한 아이디어를 구현해 드립니다.,기타,5046.0,Jemma220,기타
Rest 프레임워크 환경 파이썬 장고 기반 구축해 드립니다.,프로그래밍,5047.0,oxyzn,코딩
유니티2D 안드로이드 게임 제작해드립니다,디자인,5048.0,프로포폴,게임·AR·VR
뱅킹. 커머스 전문 경력 20년 경험의 노하우를 제공해 드립니다.,기타,5049.0,PersonaLab,기타
"엑셀 ,워드,한글,PPT 비밀번호 암호 풀어드립니다.",데이터,5050.0,성공도우미,액셀.스프레드시트
자신만의 특별한 홈페이지를 제작해 드립니다.,홈페이지,5051.0,냥웅냥,웹 제작
AWS 설계/구축/운영/교육 제공해 드립니다.,기타,5052.0,kimdragon50,데이터 구매
GIS DB 구축 및 편집해 드립니다.,기타,5053.0,친절한GIS도우미,데이터 구매
웹페이지 개선/수정,홈페이지,5055.0,Chance235,웹 제작
"웹·앱 반응형,디자인, 퍼블리싱 맞춤제작 수정 작업해 드립니다.",모바일,5058.0,엠제이주식회사,웹 유지보수
설문지 데이터 입력해드립니다,데이터,5059.0,spss,크롤링.스크래핑
티스토리 자동 포스팅으로 생활의 자동화를 시작해 보세요,기타,5060.0,moonbird,프로그램 자동화
"Flutter, 모바일 앱 빠르게 만들어 드립니다.",모바일,5062.0,SmlieDeveloper,앱
아이폰 안드로이드 하이브리드 모바일웹 만들어 드립니다.,홈페이지,5064.0,SunriseCreative,앱
웹사이트 개선·버그수정,홈페이지,5065.0,나는판다,웹 유지보수
"업무자동화, 시스템자동화 구현해 드립니다.",기타,5066.0,효율자동화쟁이,프로그램 자동화
MS SQL 이중화 Alwayson 및 MSCS 구성,프로그래밍,5067.0,KSEM,기타
고객님의 사이트에 실시간 채팅을 개발해 드립니다.,프로그래밍,5069.0,포렉스리가,웹 유지보수
최고의 퀄리티로 홈페이지 제작해 드립니다.,홈페이지,5070.0,FREER,웹 제작
아임웹 5년 경력자가 맞춤형 홈페이지 만들어드립니다,홈페이지,5073.0,HarryJang,웹빌더
검색 엔진 구축 엘라스틱서치 elasticsearch 드립니다.,기타,5074.0,makjune,데이터 구매
딥러닝 전문가 팀들이 원하시는 딥러닝 모델을 만들어 드립니다.,데이터,5075.0,Lilcob,기타
"웹크롤링, 엑셀 vba 자동화",데이터,5076.0,러블리명탐정1271,웹빌더
다양한 업종의 고퀄리티 반응형 홈페이지 제작해 드립니다.,홈페이지,5077.0,신비웹,웹 제작
NFT발행 및 민팅사이트 제작까지 드립니다.,프로그래밍,5078.0,NFT사냥꾼,웹 제작
아발란체 토큰 제작 해 드립니다.,프로그래밍,5079.0,OMD,웹 제작
이더리움 ERC20 웹지갑 만들어 드립니다.,홈페이지,5080.0,원펀,웹빌더
고난이도 크롤링 작업해 드립니다.,데이터,5081.0,HAWK,크롤링.스크래핑
원하시는 프로그램 개발해 드립니다.,프로그램,5082.0,ninox,프로그램 유지보수
"카페24,고도몰,식스샵 등 쇼핑몰 수정 해 드립니다.",커머스,5083.0,YMin,웹 제작
"빠르고 정확한, 윈도우 응용프로그램,웹을 개발해 드립니다.",프로그램,5084.0,전문개발자,웹 유지보수
오라클 설치 복구 이관 등 기술지원,기타,5085.0,오라클엔지니어,하드웨어·임베디드
웹페이지 크롤러 프로그램 만들어 드립니다.,프로그램,5086.0,러버덕101,웹 제작
"토큰, 리워드 서비스, 디파이 컨트랙트 개발해 드립니다.",프로그래밍,5087.0,클레이튼디파이전문가,블록체인·NFT
자동화 매크로 윈도우 프로그램 제작해 드립니다.,프로그램,5088.0,이효성,프로그램 자동화
홈페이지 깔끔하게 제작해 드립니다.,홈페이지,5089.0,똘똘말잉,웹 제작
온라인 데이터 자동 수집 프로그램 만들어 드립니다.,데이터,5090.0,Pythonista,크롤링.스크래핑
앱 안드로이드 ios 최고 퀄리티로 앱개발해 드립니다.,모바일,5091.0,앱플랫폼만드는전문가,앱
코인 마틴 매매프로그램 및 다양한 맞춤 개발하여 드립니다.,프로그램,5092.0,나도프로그래머,블록체인·NFT
"S기업 데이터분석 현직자, 간단한 분석 빠르게 가능",데이터,5093.0,마우스볼,데이터 전처리.분석.시각화
쇼핑몰 데이터 크롤링. 잘 팔리는 상품 찾기.,데이터,5095.0,K9027456501,크롤링.스크래핑
워드프레스 웹사이트 제작해 드립니다.,홈페이지,5096.0,도화지색연필,웹빌더
윈도우 응용프로그램 개발해 드립니다.,프로그램,5097.0,좋은남자,웹 유지보수
Java 기반 웹 프로그램 제작해 드립니다,프로그램,5098.0,관대한계란8025,웹 제작
게임 모델링 리깅 애니메이션 작업 진행해 드립니다.,게임,5101.0,MaxMan,게임·AR·VR
"영상처리, 딥러닝 응용프로그램 개발해 드립니다.",데이터,5102.0,proc,웹 유지보수
"웹사이트 수정, 개선, 기능추가해 드립니다.",홈페이지,5103.0,티블록,웹 유지보수
"웹 표준, 웹 접근성을 바탕으로 서비스를 드립니다.",홈페이지,5104.0,포도뮤,웹빌더
아임웹 반응형 홈페이지 제작해드립니다.,홈페이지,5105.0,듀라코퍼레이션,웹 제작
아마존AWS 워드프레스 기반 홈페이지 만들어 드립니다.,홈페이지,5106.0,뜔뜔이,서버.클라우드
Windows+Ms sql 서버 이전 관리 응급복구 유지보수 해 드립니다.,데이터,5107.0,개발자김팀장,서버.클라우드
"이벤트 및 서비스, 상품소개 랜딩페이지를 제작 해 드립니다.",프로그래밍,5108.0,이올디자인,웹 제작
아티스틱한 AR 인터렉션 콘텐츠 제작해 드립니다.,UnReal,5110.0,ShueArt,마케팅·광고
XE 및 그누보드 카페24 기반 사이즈 제작 및 수정해 드립니다.,프로그래밍,5111.0,캣민트,웹 제작
웹사이트 제작과 수정해 드립니다.,홈페이지,5112.0,원페이지코드,웹 제작
쇼핑몰 정확한 품질 만들어 드립니다.,커머스,5113.0,jeipro,웹 제작
"Matlab 매트랩 개발 알고리즘, GUI해 드립니다.",프로그래밍,5114.0,윤진로직,웹 유지보수
REST API 개발해 드립니다.,프로그래밍,5115.0,Cheeseburger,웹 유지보수
REST API 연동해 드립니다.,기타,5116.0,Cheeseburger,기타
"Springboot, netty로 소켓통신 개발 해 드립니다.",프로그래밍,5117.0,yant,웹 유지보수
RTSP스트림을 웹으로 재생 가능한 스트리밍서버 만들어 드립니다.,홈페이지,5118.0,yant,웹빌더
웹 페이지 간단한 수정작업해 드립니다.,홈페이지,5119.0,DEVFATH,웹 유지보수
App Web 화면설계서 스토리보드 제작해 드립니다.,프로그래밍,5120.0,tuttle,웹 제작
"ERC,솔라나,폴리곤 토큰, 웹페이지 및 NFT 제작해 드립니다.",홈페이지,5121.0,NFT제작인,웹 제작
홍보 홈페이지는 홍보 전문가에게 제작하세요,홈페이지,5122.0,피알홈페이지,웹 제작
"검색 잘 되고, 방문자가 좋아하는 반응형 홈페이지 제작",홈페이지,5123.0,웨일개발팀,웹 제작
GIS 도형 데이타 입력 편집 좌표변환 작업을 해 드립니다.,기타,5124.0,Synapse,기타
만족드리는 유니티 Unity 게임 개발해 드립니다.,디자인,5125.0,백해규,게임·AR·VR
모든 웹 퍼블리싱 해 드립니다.,홈페이지,5126.0,922km,웹 유지보수
"반응형 사이트, 원하는 작업물 나올때까지 수정해 드립니다.",기타,5127.0,유라ent,웹 유지보수
"블록체인 백서, 홈페이지 맞춤형 제작 드립니다.",홈페이지,5128.0,주식회사제이블럭,웹 제작
6년차 퍼블리셔 웹 모바일 랜딩페이지 깔끔하게 제작해 드립니다.,홈페이지,5129.0,윤자매맘,웹 제작
웹사이트 페이지의 유지보수를 도와 드립니다.,홈페이지,5131.0,youngjae,웹 유지보수
최적화 반응형 홈페이지 만들어 드립니다.,홈페이지,5133.0,끈질긴영웅779,웹 제작
"블로그,쇼핑등 유입수늘리는 키워드 추출 엑셀파일 제작해 드립니다.",데이터,5134.0,이지데일리,액셀.스프레드시트
"HTML,CSS, JS ,jQuery등 코딩해 드립니다",홈페이지,5135.0,어느봄날하늘,코딩
여러분만의 홈페이지를 제작 해드립니다,홈페이지,5136.0,오늘도100프로,웹 제작
바이낸스 BEP-20 제작해 드립니다.,프로그래밍,5137.0,web3expert,웹 제작
"gis, Arcgis,Qgis 가공, python 제작",프로그래밍,5138.0,Pytube,웹 제작
홈페이지를 제작 해 드립니다.,홈페이지,5139.0,엔에스텍,웹 제작
"생각하시는 그대로, 그이상의 쇼핑몰을 제작 해 드립니다.",커머스,5140.0,엔에스텍,웹 제작
구글최적화 반응형 워드프레스 사이트 제작해 드립니다.,홈페이지,5141.0,itdaweb,액셀.스프레드시트
"PC조립,수리,유지보수",프로그래밍,5142.0,editerjunjun,웹 유지보수
솔라나 토큰 발행 및 관리자 사용법 교육까지 -SPL,기타,5143.0,Solana,교육·컨설팅
파이썬 자동화 프로그램 만들어 드립니다.,프로그램,5144.0,허브티,코딩
NFT 시작을 위한 디스코드 서버 구축해드립니다.,데이터,5145.0,스폐셜리스트,서버.클라우드
엑셀 vba 및 매크로를 활용한 맞춤 템플릿 제작해 드립니다.,데이터,5146.0,라피네풍,액셀.스프레드시트
품질 좋은 프로그램 개발해 드립니다.,프로그램,5147.0,그랑블루팩토리,프로그램 유지보수
2023년 연차계획서,기타,5148.0,yeolmune,기타
임베디드 카메라 센서 개발해 드립니다.,프로그래밍,5149.0,swing,하드웨어·임베디드
임베디드 장치 제어 및 서버 클라이언트 시스템 개발해 드립니다.,데이터,5150.0,swing,하드웨어·임베디드
web K. 그누보드 기반의고퀄 디자인 홈페이지 제작해 드립니다.,홈페이지,5151.0,웹케이,웹 제작
파이썬 모듈 제작 딥러닝 머신러닝 모델 등 드립니다.,데이터,5153.0,epsilondelta,코딩
SQL 개발 및 튜닝 Migration DA해 드립니다.,프로그래밍,5154.0,곰이사,웹 유지보수
게임 기능 혹은 게임 제작 해 드립니다.,게임,5155.0,닉넴할거없다,게임·AR·VR
깔끔하게 윅스 홈페이지 제작해 드립니다.,홈페이지,5156.0,디자인마스터즈,웹 제작
웹과 모바일 앱을 취약점 진단 및 모의해킹 해 드립니다.,모바일,5157.0,KANU,웹빌더
"HTML, CSS, jQuery 웹 퍼블리싱 작업해 드립니다.",홈페이지,5158.0,호우린,웹 유지보수
"아이폰 앱 iOS 안드로이드 앱을 수정, 등록해 드립니다.",모바일,5159.0,TeamBridge,앱
빠르게 VR AR MR 완벽하게 만들어 드립니다.,UnReal,5160.0,파랑등대,기타
PHP MySql Jquery 유지보수 수정작업을 해 드립니다.,기타,5161.0,MiKyungChoi,웹 유지보수
웹 페이지 및 SNS 데이터 크롤링해 드립니다.,데이터,5162.0,전문가오리,크롤링.스크래핑
"반응형,일반형 홈페이지 제작해 드립니다.",홈페이지,5163.0,DESIGNPIE,웹 제작
웹퍼블리싱 제작 해 드립니다.,홈페이지,5164.0,DESIGNPIE,웹 제작
꼬꼬마 프로그래머가 웹사이트 버그를 수정해 드립니다.,홈페이지,5165.0,개발조무사,웹 유지보수
머신러닝 수치해석 프로젝트 솔루션 제공해 드립니다.,데이터,5166.0,DNS,머신러닝 딥러닝
샘플URL 또는 기획서를 전달받아 웹사이트를 제작해 드립니다.,홈페이지,5167.0,킴양지,웹 제작
현 네카라 개발자가 안드로이드 앱 개발해 드립니다.,모바일,5169.0,드뷔시,앱
C 소스 분석 버그 원인 분석해 드립니다.,프로그램,5170.0,케이론,데이터 전처리.분석.시각화
객체를 내것으로 C플러스플러스 드립니다.,프로그래밍,5171.0,케이론,기타
체계적인 자산관리를 위한 엑셀 가계부,데이터,5172.0,자산메니저,재무·회계
매출 및 광고 효율 개선을 위한 마켓 데이터 분석을 해 드립니다.,데이터,5173.0,HONES,마케팅·광고
워드프레스의 텍스트 이미지 최적화 개발 등을 작업해 드립니다.,홈페이지,5174.0,locozdesign,웹빌더
홈페이지 제작의 모든것 차별화된 웹사이트를 제작해 드립니다.,홈페이지,5175.0,locozdesign,웹 제작
"UI/UX 개발자입니다. html, css, js",기획,4840.0,새싹따릉이,기타
소규모 그룹웨어를 만들어 드립니다.,기타,5176.0,리얼마니,기타
원하시는 홈페이지 만들어 드립니다.,홈페이지,5177.0,미소짓는지구,웹 제작
사업에 필요한 앱/웹 IT 서비스 기획 스토리보드 제작 드립니다.,모바일,5178.0,JAC,웹 제작
"웹사이트 기능 수정, 추가, 버그 수정 해드립니다.",홈페이지,5179.0,JessicKim,웹 유지보수
인터넷에서 원하는 정보를 크롤링해 드립니다,데이터,5180.0,두플,크롤링.스크래핑
실력을 쌓고 있어요. 웹 페이지 만들어 드립니다.,홈페이지,5132.0,태태TaeTae,웹빌더
엑셀을 이용해 원하시는 모든 것을 마법처럼 만들어 드립니다.,데이터,5181.0,지미팍,액셀.스프레드시트
원하는 데이터 수집하여 워드클라우드를 만들어 드립니다.,데이터,5182.0,생활DS,크롤링.스크래핑
Krpano를 이용한 VR웹페이지 제작해 드립니다.,UnReal,5183.0,엔엘씨브이알,웹 제작
쇼피파이 해외 글로벌 쇼핑몰 제작 운영 A부터Z 까지,커머스,5184.0,해외마케터,웹 제작
아파트 실거래가 뽑아 드립니다.,기타,5185.0,스마트스투키,기타
"귀찮은 반복 끝, 크롤러 제작해드립니다.",프로그래밍,5186.0,개발전문가1,프로그램 자동화
웹 사이트 간단한 소스 수정해 드립니다.,홈페이지,5187.0,initialize,웹 유지보수
웹사이트 유지 보수 저렴한 가격에 깔끔하게 해 드립니다.,홈페이지,5188.0,DongwookLim,웹 유지보수
안드로이드 모바일웹을 앱패키징 해 드립니다.,모바일,5189.0,teras,앱
안녕하세요 센스있는 퍼블리싱으로 홈페이지를 빛내 드립니다.,홈페이지,5190.0,아웅이,웹 유지보수
워드프레스 서버 세팅과 유료테마 설치합니다,홈페이지,5191.0,제이날다,웹빌더
반응형 웹사이트 퍼블리싱 작업해 드립니다.,홈페이지,5192.0,웹마스터강해성,웹 유지보수
쉘 스크립트를 통하여 모니터링 및 화 구현 해 드립니다.,기타,5193.0,꾸몽,코딩
PC 모바일 웹반응형 홈페이지 한번에 제작해 드립니다.,홈페이지,5194.0,다다애드,웹 제작
"상상만하고 구현하지 못한 2D 게임,프로그램을 만들어 드립니다.",프로그램,5195.0,yjy020892,게임·AR·VR
웹/앱 스프링부트 서버 개발해드립니다.,모바일,5196.0,saint6839,웹 유지보수
"윈도우 프로그램, 공장자동화, CIM, 자동화대응 개발",프로그램,5197.0,적토끼,프로그램 자동화
"그누보드 기반 반응형 홈페이지,랜딩페이지기획,제작해 드립니다.",홈페이지,5198.0,온앤오프,웹 제작
SEO 튜닝 완전 뽀개기 해 드립니다.,기타,5200.0,SEO튜닝마스터,웹 제작
이정도의 고퀄리티 반응형웹 제작해 드립니다.,홈페이지,5201.0,홈피나라,웹 제작
웹 퍼블리싱 원하시는 그대로 제작해 드립니다.,홈페이지,5202.0,바율,웹 제작
RestApi Swagger 제작해 드립니다.,프로그래밍,5203.0,디데카,웹 제작
C/C++/C#/Delphi/SQL 프로그램 수정해 드립니다.,프로그램,5204.0,스카이넷SW,프로그램 유지보수
깃허브GitHub로 취업 포트폴리오 도와 드립니다.,기타,5205.0,흐,코딩
"PC,MO 반응형 웹 퍼블리싱 개선유지보수 드립니다.",홈페이지,5206.0,martino,웹 유지보수
RPA 기능 제작 및 유지보수,프로그래밍,5207.0,HandMade,웹 제작
상상만 하세요 홈페이지 저희가 만들어 드립니다.,홈페이지,5208.0,오드포인트,웹 제작
UIUX 모바일 앱기획 전문가가 최고의 서비스를 설계해 드립니다.,모바일,5209.0,에버앤와이,앱
원하시는 웹 크롤링 서비스를 제공해 드립니다.,데이터,5210.0,근본,웹빌더
"주식 전체 종목 컨센서스, 재무정보, 수급 등 추출해서 드립니다.",기타,5211.0,온새미로s2,재무·회계
최신 트렌드의 다양한 홈페이지를 제작 해 드립니다.,홈페이지,5212.0,FAITHERIZM,웹 제작
앱 개발 및 컨설팅 드립니다.,모바일,5213.0,검정머리간장,앱
웹앱 기획서 스토리보드 작성해 드립니다.,모바일,5215.0,Myrealintel,앱
"웹 기반 서비스, 플랫폼 제작해 드립니다.",홈페이지,5216.0,코데브주,웹 제작
디자인과 사용성을 모두 최고의 퀄리티로 웹사이트 제작해 드립니다.,홈페이지,5217.0,웨브,웹 제작
웹 반응형 홈페이지 개발해 드립니다.,홈페이지,5218.0,트뤼펠,웹 유지보수
평생무료 상업용 홈페이지 제작하여 드립니다.,홈페이지,5219.0,상냥한크리스마스4483,웹 제작
왕초보도 가능한 워드프레스 데모사이트 제작하기 도와 드립니다.,홈페이지,5220.0,오렌지코드,웹빌더
"홈페이지, A부터 Z까지 4일안에 완성합니다",홈페이지,5221.0,BauHaus,웹 제작
웹사이트 개선버그수정 해 드립니다.,홈페이지,5222.0,루디스,웹 유지보수
"단골 유입의 열쇠, 신경마케팅 기반 웹 사이트 제작",홈페이지,5223.0,뎃돌이,웹 제작
모바일 앱 개발. 아이디어를 기술과 제품으로 바꾸어 드립니다.,모바일,5224.0,커먼코딩,앱
"웹사이트 페이지, 기능을 빠르게 수정 및 추가해 드립니다.",홈페이지,5225.0,GreatMF,웹 유지보수
VPN 솔루션 제공 혹은 VPN 서버 설치 해 드립니다.,데이터,5226.0,커스터드시스템,서버.클라우드
