서비스명,대분류,서비스번호,판매자,소분류
"기존 웹 뷰 및 레이아웃 개선, 프론트 및 백엔드 기능 개선, 반응형 웹으로 전환 드립니다.",홈페이지,4280.0,0to1,웹빌더
고객 맞춤형 반응형 웹사이트 제작해 드립니다.,홈페이지,4281.0,엘미르,웹 제작
웹 서비스 프로그램 개발해 드립니다.,프로그램,4282.0,Brez,웹 유지보수
웹 개선 및 오류 수정해 드립니다.,홈페이지,4284.0,Dev브이,웹 유지보수
아두이노를 활용한 다양한 장치 개발해 드립니다.,프로그래밍,4285.0,Marsimon,하드웨어·임베디드
운영·관리가 수월한 반응형 홈페이지를 맞춤형으로 제작,홈페이지,4286.0,Peridot,웹 제작
전자책 이북 E-BOOK 제작해 드립니다.,프로그래밍,4287.0,쓰임디자인,웹 제작
윈도우 응용어플리케이션 개발해 드립니다.,프로그래밍,4288.0,CodeSomnia,웹 유지보수
신규 웹사이트 개발해 드립니다.,홈페이지,4290.0,러그포터,웹 유지보수
React/프론트엔드/퍼블리싱 깔끔하게 진행해드립니다.,홈페이지,4293.0,프론트퍼블,직무직군
게임 개발팀에서 유니티 2D 게임 개발해드립니다.,디자인,4295.0,TeamSFB,게임·AR·VR
풀스택 개발자가 홈페이지 제작 해드립니다.,홈페이지,4297.0,KTHS,웹 제작
"웹사이트 php, 스프링 유지보수해 드립니다.",홈페이지,4199.0,발자국저장소,웹 유지보수
개인용 프로그램을 맞춤형으로 개발,프로그램,4301.0,cgod,프로그램 유지보수
간단한 프로그램 빠르게 만들어드립니다.,프로그램,4302.0,WellStream,프로그램 유지보수
스마트스토어API/웹크롤링을 이용한 상품정보 자동 수정,데이터,4304.0,크롱크롱3001,웹 유지보수
'차별화' 홈페이지 제작ㅣ전문 법인기업,홈페이지,4305.0,PictureX,웹 제작
업무용 프로그램 및 스마트팩토리 개발,프로그램,4306.0,나비아빠,프로그램 유지보수
HTML5 모든 웹 게임 제작 #모바일 #교육 #이벤트,홈페이지,4307.0,굿바이플래시,웹 제작
CAFE24 쇼핑몰 정산 기업 업무 SNS연동 개발,커머스,4308.0,원퓨처,웹 제작
"App, Web 기획서, 스토리 보드 기획해 드립니다.",기획,4309.0,무란,직무직군
더 빠른 가상화폐 자동매매 프로그램 개발해 드립니다.,프로그램,4310.0,autobot,블록체인·NFT
웹 제작 추월차선 2022년 최신 반응형 3일 완성,홈페이지,4311.0,뉴리치마인드,웹 제작
react / nextjs 웹 개발,홈페이지,4313.0,스택오버플로,웹 유지보수
"android, ios 를 동시에 개발,배포 해드립니다",프로그래밍,4314.0,동현98,웹 유지보수
매크로 크롤링 자동화 RPA 제작해드립니다.,데이터,4316.0,하이어시스템,프로그램 자동화
"안드로이드, 아이폰 앱 패키징을 해 드립니다.",모바일,4318.0,유레카엔터프라이즈,앱
웹 유지보수 및 개선,홈페이지,4319.0,웹닥터,웹 유지보수
그누보드/영카트 기반 수정 및 유지보수 해드립니다.,기타,4320.0,아이다스튜디오,웹 유지보수
카페24 쇼핑몰 간단한 수정 부터 유지보수 작업을 도와 드립니다.,커머스,4325.0,더블유쓰리디자인,웹 유지보수
글로벌 비즈니스 웹사이트 제작 WIX 워드프레스 드립니다.,홈페이지,4329.0,katejeon,웹 제작
다량의 신주소 구주소 변환 및 주소별 GPS 좌표를 변환 해 드립니다.,기타,4332.0,database전문가,기타
쇼핑몰 유지 보수 및 개발해 드립니다.,커머스,4341.0,sun웹개발자,웹 유지보수
다양한 웹 템플릿 설치 및 서버를 구축 및 세팅해 드립니다.,홈페이지,4342.0,마케롱,웹빌더
매출이 상승하는 홈페이지를 개발해 드립니다.,홈페이지,4343.0,주식회사알파브라더스,웹 유지보수
코인 가상화폐 자동매매 프로그램 제작,프로그램,4345.0,창창한달맞이꽃6127,블록체인·NFT
급여관리 엑셀자동화 프로그램,데이터,4346.0,CellPro,액셀.스프레드시트
머신러닝 딥러닝을 이용한 데이터모델링 도와드립니다,데이터,4347.0,Veritasomnia,머신러닝 딥러닝
안드로이드 앱 버그 수정,모바일,4348.0,성실하고꼼꼼한개발자,앱
"Unity 기반 VR 게임, 프로그램 개발해 드립니다.",프로그램,4349.0,PHILOSO,게임·AR·VR
TTS Javascript 음성변환 API 제공해 드립니다.,기타,4352.0,BlueMakers,기타
"java, script, sql 웹 개발 및 유지보수",홈페이지,4354.0,퐁고,웹 유지보수
기업의 특징을 잘 살릴 수 있는 반응형홈페이지 제작해 드립니다.,홈페이지,4355.0,Deaube,웹 제작
5년차 디블리셔가 디자인부터 퍼블리싱까지 해 드립니다.,디자인,4356.0,Deaube,웹 유지보수
일단 의뢰해 보세요 데이터 가공해 드립니다.,데이터,4357.0,TeamJJ,크롤링.스크래핑
서울대 데이터 분석 및 ML/DL 모델링 도와드립니다,데이터,4358.0,주셉,크롤링.스크래핑
반응형 웹 페이지 제작 도와드립니다.,홈페이지,4359.0,Brent,웹 제작
풀반응형 원페이지 사이트 제작해 드립니다.,프로그래밍,4360.0,illyweb,웹 제작
Pinterest 핀터레스트 전환 추적 설치해드립니다.,기타,4365.0,개밥그릇,하드웨어·임베디드
반응형 홈페이지 제작해 드립니다.,홈페이지,4366.0,카르멜디자인,웹 제작
Jitsi Meet 기반 화상회의 시스템 구축해 드립니다.,기타,4367.0,봉봉봉님,데이터 구매
"안드로이드, 아이폰 앱을 개발해 드립니다.",모바일,4368.0,에픽핫,앱
SSL인증서 설치 및 갱신 해 드립니다.,기타,4372.0,Linux,하드웨어·임베디드
"글로벌 기업형 웹, 쇼피파이,WIX,워드프레스 웹사이트",홈페이지,4373.0,친한아는언니,웹빌더
DID KIOSK 전광판용 방송 송출 프로그램을 개발해 드립니다.,프로그램,4374.0,주식회사팀올K9,프로그램 유지보수
엑셀작업 해드립니다,데이터,4375.0,산호세소프트,액셀.스프레드시트
웹 크롤링 자동화 프로그램을 제작해 드립니다.,데이터,4376.0,케이알랩바이오,웹 제작
구글 애널리틱스 GA4 GTM nPay 세팅해 드립니다,기타,4377.0,네이든,액셀.스프레드시트
서비스에 맞게 DBMS 구조 설계 및 구축해 드립니다.,기타,4378.0,푸카,데이터 구매
제대로 된 맞춤형 고퀄리티 반응형 홈페이지 제작,홈페이지,4383.0,탑맨,웹 제작
앱의 개발의 모든 문제를 함께해 드립니다.,모바일,4384.0,pdeveloper,앱
관리자페이지 제작PHP 해 드립니다.,프로그래밍,4386.0,웹개발자입니다,웹 제작
인프라/부동산PF 수지표/재무모델 서비스를 제공해 드립니다.,기타,4388.0,디티,직무직군
"웹 크롤링, 크롤러, 자동화 도와드립니다.",데이터,4389.0,DEVREPO,웹빌더
스마트 카페 메뉴판 엑셀 양식 드립니다.,데이터,4393.0,엑셀마왕,액셀.스프레드시트
엑셀 초보자도 관리하는 연차관리 양식 입사일기준 드립니다.,데이터,4394.0,엑셀마왕,액셀.스프레드시트
모든 형태의 웹사이트 제작,홈페이지,4396.0,Sosofun,웹 제작
홈페이지제작 친절하게 만들어 드리겠습니다.,홈페이지,4397.0,한센,웹 제작
금융권 출신 개발자 SQL개발 및 작업을 지원해 드립니다.,프로그래밍,4398.0,hunahuna,웹 유지보수
아이티맥스 웹 유지보수 및 개발해 드립니다.,홈페이지,4399.0,아이티맥스,웹 유지보수
iOS 네이티브 앱 개발 해드립니다.,모바일,4401.0,kmbxxxg,앱
디스코드 봇 코드 개발 외주해 드립니다.,프로그래밍,4403.0,기르가즈,봇.챗봇
반응형 랜딩 홈페이지 원페이지형 제작해 드립니다.,홈페이지,4404.0,달리는고슴도치,웹 제작
카카오톡 플러스친구 챗봇을 맞춤제작 해드립니다.,인공지능,4407.0,Flutter,봇.챗봇
깔끔한 반응형 사이트에 무료 도메인까지 한번에 해 드립니다.,기타,4408.0,DoorOfWeb,기타
파워비아이 Power BI 대쉬보드/ 엑셀 모든 기능,데이터,4409.0,BusinessAnalyst,액셀.스프레드시트
카페24 코드 수정해 드립니다.,기타,4410.0,웹디자이너김영우,웹 유지보수
고객과 함께 고민하고 책임감있게 제작해 드립니다.,프로그래밍,4412.0,sicse,웹 제작
안드로이드 네이티브 앱 개발 해드립니다.,모바일,4413.0,모과이,앱
PC와 모바일 반응형 심플한 홈페이지 초저가로 제작해 드립니다.,홈페이지,4414.0,루트페이지,웹 제작
아두이노 전자회로 구현을 도와 드립니다.,기타,4415.0,아폴로전자BNK3R,하드웨어·임베디드
깔끔한 pc모바일 홈페이지를 제작해 드립니다.,홈페이지,4416.0,웨버개발자,웹 제작
키오스크 DID 개발해 드립니다.,프로그래밍,4417.0,디자인포엔,웹 유지보수
안드로이드 IOS 앱 수정 및 기능 추가해 드립니다.,모바일,4418.0,AppDev,앱
".NET, c# 응용프로그램 개발, delphi",프로그램,4419.0,JAVASCRIPT,웹 유지보수
"VR 게임, 교육용 VR 및 AR 제작해 드립니다.",UnReal,4420.0,VRMaker,게임·AR·VR
"JSP, Jqeury, Java 웹 개발 및 유지보수",홈페이지,4421.0,여유로운공작새,웹 유지보수
WIX 윅스 홈페이지 원포인트 해결 해드립니다.,홈페이지,4422.0,BrownKIM,웹빌더
고도몰5 간단한 수정 튜닝 상담과 작업 진행해 드립니다,기타,4423.0,댕댕커머스,웹 유지보수
"웹, 모바일, 앱 등 웹표준 퍼블리싱 해드립니다.",모바일,4424.0,alphabet,웹 유지보수
PC 윈도우 프린터 장애 오류 해결해 드립니다.,프로그래밍,4426.0,개인방송스튜디오구성,기타
매크로 업무 화 프로그램 개발해 드립니다.,프로그램,4427.0,만들남,프로그램 자동화
"Unity, android 기능 구현해 드립니다.",기타,4428.0,임효섭,기타
SEO 최적화된 고품질 랜딩페이지를 맞춤제작해드립니다.,프로그래밍,4429.0,TNIX,웹 제작
업무 자동화 매크로 프로그램 개발해 드립니다.,프로그램,4430.0,민돌E,프로그램 자동화
파워 포인트 pptx 파일을 자동으로 생성 해 드립니다.,기타,4432.0,야무진병아리5159,프로그램 자동화
웹페이지 크롤링 데이터 자동수집기,데이터,4433.0,bluebanana,크롤링.스크래핑
프로그래밍에 대한 문제 해결을 해 드립니다.,프로그래밍,4436.0,shlee1990,코딩
웹 퍼블리싱 신속하게 도와드리겠습니다.,홈페이지,4437.0,코잘러,웹 유지보수
안드로이드 하이브리드 앱 패키징,모바일,4438.0,CARRYIT,앱
카페24 꼼꼼하게 유지보수 수정해 드립니다.,기타,4439.0,Designjjang,웹 유지보수
구글플레이스토어 리뷰 크롤링 드립니다.,데이터,4441.0,냉면킬러,크롤링.스크래핑
QA TC 결함관리대장 템플릿,프로그래밍,4442.0,MasterPlanner,기타
게임 및 애니메이션 배경 일러스트 작업 해 드립니다.,게임,4443.0,데브네스트,게임·AR·VR
"조립 PC 견적 상담, 조립 해 드립니다.",프로그래밍,4444.0,Think about,기타
주식 매매 프로그램 특징종목 포착 / HTS 차트연동,프로그램,4445.0,entrophy,프로그램 유지보수
풍부한 노하우로 Unity 개임 개발 진행해 드립니다.,프로그래밍,4446.0,나르메,웹 유지보수
대학생 페이로 반응형 웹사이트 제작해 드립니다.,홈페이지,4447.0,웹만하는대학생,웹 제작
"쇼핑몰 이커머스 유지보수, 신규기능 추가 해 드립니다.",커머스,4449.0,Codingismylife,웹 제작
임베디드 커스텀 PCB 설계 제작하여 드립니다.,프로그래밍,4450.0,닥터KO,하드웨어·임베디드
디스코드 챗봇 만들어드립니다.,인공지능,4451.0,비중간계의상자,봇.챗봇
블록체인 관련 모든 서비스 만들어 드립니다.,기타,4452.0,enos,기타
완벽한 홈페이지를 제작해드립니다.,홈페이지,4453.0,발효,웹 제작
스크래핑 크롤링 공인인증서 로그인 사이트 전부 가능,데이터,4455.0,스크래핑전문가,크롤링.스크래핑
혁신적인 UI UX가 필요한 윈도우 프로그램 제작,프로그램,4456.0,개발이좋은개발자,프로그램 유지보수
"5년 노하우, 워드프레스검색 최적화 세팅 및 설치해 드립니다.",홈페이지,4457.0,더좋은디자인,웹빌더
원하시는 홈페이지 제작해 드립니다.,홈페이지,4458.0,준오네,웹 제작
Qt / Windows GUI 프로그램,프로그램,4460.0,고투개발,프로그램 유지보수
스콤 SCORM 이러닝 학습 콘텐츠를 개발해 드립니다.,프로그래밍,4462.0,STORYLINE360,교육·컨설팅
성공적인 비즈니스를 위한 최상의 홈페이지를 제작해 드립니다.,홈페이지,4463.0,modoodesign,웹 제작
편집 불가능한 배포용 한글 문서를 편집 가능하게 만들어 드립니다.,데이터,4464.0,똑똑한올빼미,기타
공간 제작 고인물이 제페토 월드맵 제작해 드립니다.,프로그래밍,4466.0,구글광고나야나나야나나야나나야나,웹 제작
검색시 노출될 수 있도록 SEO최적화 작업해 드립니다.,기타,4467.0,리웹,기타
PDF파일변환 및 GIF 파일변환,기타,4469.0,무역전문가,기타
엑셀 VBA 크롤링 데이터 정보 이미지 드립니다.,데이터,4472.0,ESN엑셀을사랑하는남자,크롤링.스크래핑
IOS/안드로이드 앱 동시에 개발해 드립니다.,모바일,4473.0,와이제이테크,앱
공격자 관점 모의해킹 해 드립니다.,기타,4474.0,ExploitLab,기타
고퀄리티 펜션 반응형 홈페이지를 만들어 드립니다.,홈페이지,4475.0,이홈피넷,웹 제작
디자인 반응형 기업 홍보형 홈페이지 만들어 드립니다.,홈페이지,4476.0,이홈피넷,웹 제작
"PC , 원격으로 만족할때까지 서비스 해드립니다.",프로그래밍,4477.0,빵Love,기타
아이폰 iOS 퀄리티 있는 네이티브 앱 개발부터 배포해 드립니다.,모바일,4478.0,앱공방,앱
"반응형 홈페이지 제작, LMS 홈페이지 제작해드립니다.",홈페이지,4480.0,웹캔두잇,웹 제작
3일만에 웹서비스 제작하기,홈페이지,4481.0,노코드개발자,웹 제작
IPSecVPN/SSLVPN설정해 드립니다.,기타,4482.0,12년차데브옵스,기타
RTSP CCTV 카메라 웹 스트리밍 서버를 만들어 드립니다.,홈페이지,4483.0,너그러운갈매기9060,웹빌더
디스코드 봇을 맞춤 제작해드립니다.,프로그래밍,4484.0,Junah,봇.챗봇
현직 IT기업 8년차가 꼼꼼하게 퍼블리싱 해드립니다.,홈페이지,4485.0,얼굴제작소,웹 유지보수
"컴퓨터 구매, 대행, 수리,AS, 업그레이드 진행합니다",기타,4486.0,완또남,하드웨어·임베디드
고급 퀄리티의 반응형 홈페이지 쇼핑몰 분양를 제작전문,커머스,4487.0,이모션7,웹 제작
개발 위탁 시 필수인 앱 웹 스토리보드 제작해 드립니다.,모바일,4488.0,GoldLane,웹 유지보수
블록체인 코인 발행,기타,4489.0,Python과AWS,블록체인·NFT
바코드 프로그램 주문제작해 드립니다.,프로그램,4490.0,미래코드,프로그램 유지보수
나만의 글자수 세기 프로그램 만들기,프로그램,4491.0,Markism,프로그램 유지보수
SQL 짜드립니다.,기타,4492.0,햄복지수,기타
웹 개발 유지보수 서비스 도와드립니다.,홈페이지,4493.0,꼼꼼한웹개발자,웹 유지보수
해외 구매대행 쇼핑 웹 소싱 크롤링해 드립니다.,데이터,4495.0,stonemodoo,웹빌더
틱톡앱 데이팅앱 소개팅앱 화상채팅 똑같게 드립니다.,모바일,4496.0,DealDeal,앱
"코딩없이 메일, 휴대폰 인증 자동화하기",기타,4497.0,노코드햄스터,코딩
"GoogleDrive 폴더 구조화, 파일 업로드 자동화",기타,4498.0,노코드햄스터,프로그램 자동화
"웹 파싱,크롤링,스크래핑해 드립니다.",데이터,4499.0,AI테크,웹빌더
크롤링 기반 데이터 수집 프로그램 개발합니다,데이터,4500.0,응용프로그래머,크롤링.스크래핑
IT 웹앱 플랫폼 MVP Product 개발해 드립니다.,모바일,4501.0,티릴리,앱
"쇼핑몰 오류 수정, 기능 추가해 드립니다.",커머스,4502.0,82나는개발자,웹 제작
아임웹 홈페이지 웹사이트 모든 기능 제작,홈페이지,4503.0,인디컬쳐스,웹 제작
Excel 함수 작업해 드립니다.,기타,4504.0,엑셀함수,기타
뚝딱뚝딱 빠르고 정확하게 제작해 드립니다.,프로그래밍,4505.0,웹제작소,웹 제작
제어 및 계측 분석 LabVIEW 프로그램 개발,프로그램,4506.0,코라텔,데이터 전처리.분석.시각화
"C/C++, Python 프로그래밍, 작성/수정",프로그래밍,4507.0,전세영,코딩
데이터 수집 / 웹 크롤링 깔끔하게 해드립니다.,데이터,4508.0,시애틀데이터사이언티스트,크롤링.스크래핑
웹 퍼블리싱 작업해 드립니다.,홈페이지,4509.0,또동,웹 유지보수
반응형 웹사이트 제작해드립니다.,홈페이지,4510.0,챈채니,웹 제작
고객만의 색을 위한 반응형 회사소개 사이트 제작해 드립니다.,프로그래밍,4511.0,컬러스개발,웹 제작
검색 잘 되는 워드프레스 홈페이지 제작,홈페이지,4513.0,루다마루,웹 제작
검색 잘 되는 반응형 홈페이지 제작,홈페이지,4514.0,루다마루,웹 제작
"iOS,안드로이드 앱 동시 개발 해 드립니다.",모바일,4515.0,코리아킹스,앱
아름답고 액티비한 안드로이드앱과 아이폰앱을 만들어 드립니다.,모바일,4516.0,씨레벨,앱
AWS 구축과 컨설팅 최선을 다해 지원해 드립니다.,기타,4517.0,AWS뉴페,데이터 구매
꼼꼼하게 퍼블리싱 작업해 드립니다.,홈페이지,4518.0,hirui,웹 유지보수
"java,jsp 홈페이지 수정",홈페이지,4519.0,온화한치와와,웹 유지보수
홈페이지 리뉴얼 도와 드립니다.,홈페이지,4520.0,거북이문,웹 제작
고객 맞춤형 웹사이트 퍼블리싱해 드립니다.,홈페이지,4521.0,이엘코드,웹 유지보수
빠르고 깔끔하게 반응형 웹 퍼블리싱해 드립니다.,홈페이지,4522.0,웹JIN,웹 유지보수
AOS 네이티브앱 유지보수해 드립니다.,모바일,4525.0,허당도사,웹 유지보수
심플한 홈페이지 제작해 드립니다.,홈페이지,4527.0,몬드라라,웹 제작
워드프레스 원하는대로 빠르게 수정해 드립니다.,홈페이지,4528.0,웨이비,웹빌더
DBMS 쿼리를 작성해 드립니다.,기타,4529.0,DB왕 봉식이,데이터베이스
20년 내공 델파이 리눅스유닉스C 개발하여 드립니다.,프로그래밍,4530.0,K2635531503,서버.클라우드
쇼핑몰 최적화 기획 완료된 관리자 스토리보드 제공 드립니다.,커머스,4531.0,innotive,웹 제작
반응형 서브 페이지 코딩해 드립니다.,기타,4532.0,레몽코딩,코딩
데이터 수집 깔끔하게 끝내고 싶은 분만 문의주세요,데이터,4533.0,필요한,크롤링.스크래핑
노션과 oopy를 통해 린하게 mvp를 만들어 드립니다,기타,4534.0,그루위Growee,웹빌더
vimeo비메오 웹플레이어 제작해 드립니다.,홈페이지,4536.0,태풍,웹 제작
웹 소스코드 모바일 앱 중요 정보자산 모의해킹해 드립니다.,모바일,4537.0,kargan,웹빌더
중소업체 전자 제품 개발 생산 해 드립니다.,프로그래밍,4538.0,개발전문인스텍,웹 유지보수
"빠르게 SNS, 웹 데이터 크롤링해 드립니다.",데이터,4539.0,니스역,크롤링.스크래핑
"회로, PCB, 펌웨어, STM32 개발 및 디버깅 해 드립니다.",프로그래밍,4540.0,전자회로의신,웹 유지보수
쉘스크립트 Shell Script Perl Python 제작하여 드립니다.,프로그래밍,4541.0,oxyzn,코딩
Grafana 그라파나 대시보드 구축 및 구성해 드립니다.,기타,4542.0,oxyzn,데이터 구매
윈도우 응용 프로그램 개발 드립니다.,프로그램,4543.0,맥베이스,프로그램 유지보수
초보자도 운영가능한 카페24 쇼핑몰 제작해 드립니다.,커머스,4544.0,Nayeonyy,웹 제작
크롬 익스텐션 개발해 드립니다.,프로그래밍,4545.0,원후민,웹 유지보수
"운영하시는 사이트 기능 개발,수정,개선 진행해드립니다.",프로그래밍,4546.0,jaejinu,웹 유지보수
"C, C++ 프로그래밍 해 드립니다.",프로그래밍,4547.0,프로그래밍고오수,코딩
필요한 내용만을 쏙쏙 담아 반응형 원페이지로 제작해 드립니다.,프로그래밍,4548.0,위주디자인,웹 제작
API 연동 공공데이터 포털 PASSPORT 작업,데이터,4550.0,아침엔스팸,크롤링.스크래핑
업종에 맞는 홈페이지 제작 및 관리기능 까지 제작해 드립니다.,홈페이지,4551.0,est1984,웹 제작
"회로 PCB 설계, 다층, 임피던스 등 설계해 드립니다",프로그래밍,4552.0,파파A,기타
"구글, , 다음에서 이미지, 사진 크롤링 다운가능",데이터,4553.0,포스트IT,액셀.스프레드시트
N사 쇼핑몰사업자 DB수집 솔루션 제공해 드립니다.,커머스,4554.0,초롱이89,웹 제작
온라인 이벤트 사이트를 제작해 드립니다.,프로그래밍,4555.0,ReactNext,웹 제작
윈도우 프로그램 개발해드립니다.,프로그램,4556.0,윈도우프로그래머,프로그램 유지보수
웹 페이지 맞춤 제작해 드립니다.,홈페이지,4557.0,soodev,웹 제작
반복 업무 자동화RPA 개발해 드립니다.,프로그래밍,4558.0,지나가던행인,프로그램 자동화
간단한 프로그램 제작해 드립니다.,프로그램,4559.0,헝그리코더,프로그램 유지보수
웹 사이트와 관리자 페이지를 맞춤형으로 개발해 드립니다.,홈페이지,4560.0,TM미루,웹 유지보수
"엑셀, 워드,PPT 문서작업 도와드립니다.",데이터,4561.0,디노코코,액셀.스프레드시트
카페24 쇼핑몰 텍스트 이미지 링크 수정 작업을 도와 드립니다.,커머스,4562.0,디마스터,웹 제작
"방산장비 구조해석, 진동/충격해석 도와 드립니다.",기타,4563.0,나이스퍼처스,기타
6년차 개발자가 간단하지만 귀찮은 작업대행 및 개선작업 진행해서 고민해결해 드립니다.,프로그래밍,4564.0,WebKyu,기타
홈페이지 개발디자인을 한방에 해결해 드립니다.,홈페이지,4565.0,크림오프,웹 유지보수
폴리곤 토큰 제작해 드립니다.,프로그래밍,4566.0,OMD,웹 제작
JSP jQuery Java DB 사이트 개발해 드립니다.,프로그래밍,4567.0,프로그래머태태,웹 유지보수
상상하시는 제품 만들어 드립니다.,기타,4568.0,인에빗,기타
"금융 데이터, 쇼핑몰 데이터 크롤러 제작해 드립니다.",데이터,4569.0,카백,크롤링.스크래핑
식스샵으로 쇼핑몰 만들어 드립니다.,커머스,4571.0,코메프리마,웹 제작
식스샵으로 웹사이트 만들어 드립니다.,홈페이지,4572.0,코메프리마,기타
모두 modoo 로 홈페이지를 만들어 드립니다.,홈페이지,4573.0,코메프리마,웹 제작
반응형 웹사이트 수정 및 오류수정 솔루션 드립니다.,홈페이지,4574.0,코딩하는펭귄,웹 유지보수
"Android, iOS 앱 빠르고 확실하게 개발해 드립",모바일,4576.0,코딩하는유니콘,앱
안드로이드 어플리케이션 만들어 드립니다.,기타,4577.0,개발자필립,앱
CAE CFD 구조해석 유동해석 도와 드립니다.,프로그래밍,4578.0,신씨남자,기타
테마 주문제작 가능한 워드프레스 블로그 제작,홈페이지,4579.0,위그마,웹 제작
커머스사업 팀장이 반응형 웹페이지 제작해 드립니다.,홈페이지,4580.0,오마이스토어,웹 제작
"Flutter로 iOS,안드로이드 앱 동시에 만들어 드립니다.",모바일,4583.0,개발자베베,앱
"워드프레스 웹호스팅 단기 ,연습용 제공해 드립니다.",홈페이지,4584.0,TimeSaver4U,웹빌더
캐드 PDF 변환해 드립니다,기타,4586.0,위드유1,기타
데이터 수집/크롤링,데이터,4587.0,boogle,크롤링.스크래핑
일반 프로그램을 제작해 드립니다.,프로그램,4589.0,준수중,프로그램 유지보수
게임 사운드디자인 음악 제작해 드립니다.,디자인,4590.0,디플로피아,게임·AR·VR
"메인 홈페이지, 웹 페이지 제작해 드립니다.",홈페이지,4591.0,목장,웹 제작
의뢰자님만을 위한 최적의 반응형 웹사이트를 제작합니다.,홈페이지,4594.0,레딧스튜디오,웹 제작
"국내 최고의 전국 병원, 의원 DB를 드립니다.",기타,4595.0,RealEstateArtist,기타
HTML css Javascript 퍼블리싱 제작 드립니다.,홈페이지,4596.0,itdaweb,웹 유지보수
"웹퍼블리싱, HTML,CSS 수정 및 작업 해 드립니다.",홈페이지,4598.0,yootrue,웹 유지보수
"서비스 완성도를 위한 WEB, APP QA 테스트 해 드립니다.",기타,4600.0,코리윤,QA.테스트
Unity를 활용한 콘텐츠 제작해 드립니다.,프로그래밍,4601.0,HopeLD,마케팅·광고
블록체인/DAPP 개발해드립니다.,프로그래밍,4957.0,Python과AWS,웹 유지보수
내 것이란 생각으로 작업하여 드립니다.,기타,4604.0,이프로5959,기타
아임웹 쇼핑몰을 만들어 드립니다.,커머스,4605.0,스틱포인트,웹빌더
한국형 케이테마로 홈페이지 제작해 드립니다.,홈페이지,4606.0,K6089325181,웹 제작
아이폰 앱 iOS 안드로이드 앱 개발해 드립니다.,모바일,4607.0,TeamBridge,앱
"HTML, CSS 반응형까지 꼼꼼하게 퍼블리싱해 드립니다.",홈페이지,4608.0,코딩클링,웹 유지보수
