서비스명,대분류,서비스번호,판매자,소분류
"카페24,고도몰,메이크샵등 쇼핑몰 수정,코딩,유지보수",커머스,2102.0,logf1,웹 유지보수
"엑셀 VBA, 매크로, ERP 프로그램 개발해 드립니다.",데이터,2103.0,엑셀의신,액셀.스프레드시트
"엑셀을 이용 서식과 집계, 분석 및 VBA 프로그래밍",데이터,2105.0,태구리,액셀.스프레드시트
카페24 쇼핑몰 수정 유지보수 제작 기능개선 오류개선,커머스,2106.0,오Design,웹 제작
카페24 쇼핑몰 수정 및 개선작업 해 드립니다.,커머스,2107.0,WorldWiseWeb,웹 제작
리눅스 서버 기술지원 서버이전 SSL 장애처리,데이터,2108.0,리눅스웨어,서버.클라우드
"워드프레스 홈페이지 수정, 오류 해결, 기능 추가",홈페이지,2110.0,김대리닷넷,웹 유지보수
쎈스있는 카페24 수정유지보수 리뉴얼 코딩 해드립니다.,기타,2111.0,이쎈스,웹 유지보수
고도몰5 전문 튜닝 친절한 상담과 깔끔한 작업 진행해 드립니다.,기타,2115.0,웹개발윤서준,웹 제작
알고리즘 자료구조 등 프로그램 제작해 드립니다.,프로그램,2116.0,개발자김명준,프로그램 자동화
"웹사이트에 기능추가, 기능수정, 오류수정 해드립니다.",홈페이지,2117.0,pgkwon1,웹 유지보수
"주말작업가능 24시상담 쇼핑몰 상품등록,배너제작 해 드립니다.",커머스,2118.0,궁봇,웹 제작
"퍼블리싱 작업 html, css, jquery 작업해 드립니다.",홈페이지,2119.0,number154a,웹 유지보수
워드프레스 홈페이지 개선해 드립니다.,홈페이지,2120.0,워드넷,웹빌더
카페24cafe24 꼼꼼하게 리뉴얼 유지보수 수정해 드립니다.,기타,2121.0,김꼼꼼,웹 유지보수
홈페이지 퍼블리싱 html css 웹표준 맞춰 작업해 드립니다.,홈페이지,2122.0,닷지,웹 유지보수
"크롤링 , 크롤러 , 파싱 , 파싱기 맞춤 제작해 드립니다.",데이터,2123.0,비트박,크롤링.스크래핑
"PHP, 그누보드, 영카트, 고도몰, 카페24 등 개발, 코딩해 드립니다.",프로그래밍,2124.0,디바인,웹 유지보수
R을 활용한 데이터 분석 도와 드립니다.,데이터,2125.0,박군,크롤링.스크래핑
"웹사이트 기능추가, 오류수정 개발 작업해 드립니다.",홈페이지,2126.0,greydoll,웹 유지보수
"HTML, PHP 홈페이지 수정해 드립니다.",홈페이지,2127.0,DoubleU,웹 유지보수
"카페24,메이크샵,고도몰,기타홈페이지 수정,코딩해 드립니다.",홈페이지,2128.0,css777,웹 유지보수
PHP 개발 및 그누보드 셋팅 및 수정 도와 드립니다.,프로그래밍,2129.0,smallgate,웹 유지보수
간단한 아두이노 장치 제작해 드립니다.,프로그래밍,2130.0,수제비1,하드웨어·임베디드
프로그램 그까이꺼 원하는 대로 만들어 드립니다.,프로그램,2131.0,eternalsoft,프로그램 유지보수
홈페이지 유지 보수 해 드립니다.,홈페이지,2132.0,woong6156,웹 유지보수
안드로이드 앱 개발해 드립니다.,모바일,2134.0,로그캣,앱
이미지를 디자인파일 ai 벡터로 제작해 드립니다.,디자인,2135.0,케세라세라,웹 제작
PHP 웹 사이트 유지보수 도와 드립니다.,홈페이지,2136.0,윤푸,웹 유지보수
페이스북 픽셀 설치 도와 드립니다.,기타,2137.0,개밥그릇,하드웨어·임베디드
워드프레스 테마플러그인 수정 및 오류 해결해 드립니다.,홈페이지,2138.0,하시인,웹빌더
"엑셀 수식, VBA 매크로 해결해 드립니다.",데이터,2139.0,고모르,액셀.스프레드시트
"그누보드, 영카트 웹 사이트 수정 및 유지보수 해드려요",홈페이지,2142.0,TW,웹 유지보수
"웹사이트의 페이지, 기능을 수정 및 추가해 드립니다.",홈페이지,2143.0,와이테크,웹 유지보수
카페24 유지보수 수정 기능 추가해 드립니다.,기타,2145.0,lovleyOn,웹 유지보수
고퀄리티 반응형 홈페이지를 드립니다.,홈페이지,2146.0,포인원,웹 제작
자료구조 및 알고리즘 구현 제작하고 설명해 드립니다.,프로그래밍,2148.0,알고리즘강성주,프로그램 자동화
"크롤링, 데이터 수집, 각종 프로그램 제작해 드립니다.",데이터,2149.0,zeehastory,크롤링.스크래핑
php 홈페이지 기능추가 및 수정작업해 드립니다.,홈페이지,2152.0,lyh,웹 유지보수
구글 GA 구글 애널리틱스 설치 도와 드립니다.,기타,2153.0,개밥그릇,액셀.스프레드시트
각종 프로그램 개발 해 드립니다.,프로그램,2159.0,gaegun,프로그램 유지보수
숨은 데이터까지 크롤링해 드립니다.,데이터,2161.0,우주정복자,크롤링.스크래핑
엑셀관련 업무용 프로그램을 맞춤형으로 개발,데이터,2162.0,cgod,액셀.스프레드시트
카페24 메이크샵 유지보수 및 수정 메뉴얼 제공해 드립니다.,기타,2164.0,1pxstudio,웹 유지보수
Linux 기술지원 해 드립니다.,기타,2165.0,MasterONE,컴퓨터 기술지원
웹사이트 매크로 자동화 프로그램 제작해 드립니다.,프로그램,2166.0,소수의힘,프로그램 자동화
Android iOS 하이브리드앱 패키징,모바일,2167.0,노란창문,앱
사람 일을 대신하는 메크로 프로그램 개발해 드립니다.,프로그램,2168.0,오토프로메이커,프로그램 유지보수
퍼블리싱 반응형 빠르고 정확한 제작 해 드립니다.,홈페이지,2169.0,JeongHui,웹 유지보수
디자인 파일을 주시면 퍼블리싱해 드립니다.,디자인,2172.0,빌리블,웹 유지보수
높은 눈높이에 맞춰 고퀄리티 홈페이지 제작해드립니다,홈페이지,2174.0,심플솔루션,웹 제작
PHP Codeigniter 웹사이트 수정해 드립니다.,홈페이지,2175.0,효베르,웹 유지보수
"퍼블리싱 HTML, CSS, JS, jQuery 코딩해 드립니다.",홈페이지,2177.0,design2u,웹 유지보수
PHP JSP 웹사이트 기능개선 및 수정해드립니다,홈페이지,2178.0,규루리,웹 유지보수
MS오피스 엑셀기반 엑세스 DB 연동 솔루션 제작하여 드립니다.,데이터,2183.0,비쥬얼엑셀,액셀.스프레드시트
데이터분석 및 ML/DL 모델링 도와 드립니다.,데이터,2184.0,olleh,크롤링.스크래핑
Python으로 업무효율화 프로그램 제작해 드립니다.,프로그램,2186.0,내가묻고싶은거,프로그램 유지보수
아임웹 하단에 위로 바로 올라가는 버튼 만들어 드립니다.,홈페이지,4889.0,공명법사,웹빌더
1일이내 작업가능 웹퍼블리싱 작업해 드립니다.,홈페이지,2189.0,var,웹 유지보수
윅스WIX 빠르고 깔끔하게 만들어 드립니다.,기타,2190.0,유스트라다무스,웹빌더
컴퓨터 윈도우 오류 원격 해결 및 수리,기타,2192.0,Goaway007,하드웨어·임베디드
홈페이지 유지보수 해 드립니다.,홈페이지,2194.0,KDJ,웹 유지보수
PHP 웹사이트 수정해 드립니다.,홈페이지,2200.0,phpdev,웹 유지보수
올바르게 워드프레스 웹사이트를 옮겨 드립니다.,홈페이지,2201.0,angelBoy,웹빌더
PHP/HTML 기반 사이트 유지보수 작업해 드립니다.,홈페이지,2203.0,WizDoM,웹 유지보수
"픽셀,퍼포먼스 마케터가 진단하고 풀스택 개발자가 설치해 드립니다.",프로그래밍,2204.0,호랑이마케팅,하드웨어·임베디드
"카페24쇼핑몰 수정, 추가, 소셜로그인, 기능추가",커머스,2205.0,var,웹 제작
빠르고 완성도 있는 웹퍼블리싱 만들어 드립니다.,홈페이지,2207.0,SSOOYA,웹 유지보수
홈페이지끝판왕 카페24 cafe24 디자인수정 기능개선,홈페이지,2208.0,카페24전문,웹 유지보수
"카페24,고도몰,메이크샵,모든쇼핑몰 수정,오류,문제해결",커머스,4649.0,오즈의해결사,웹 제작
아마존 웹 서비스 AWS 에 관련된 모든것을 도와 드립니다.,홈페이지,2210.0,YoungWooJung,서버.클라우드
"엑셀, 워드, 문서작업 도와 드립니다.",데이터,2212.0,에스디엔,액셀.스프레드시트
카페24 쇼핑몰 웹 퍼블리싱 및 JS 프론트앤드 개발,커머스,2213.0,워크맨24,웹 유지보수
"생산,재고,급여,데이터 엑셀화로 업무의 효율을 높여 드립니다.",데이터,2214.0,이지엑셀,크롤링.스크래핑
웹상의 정보를 수집해 드리거나 수집 프로그램 제작 드립니다.,프로그램,2218.0,내로야,웹 제작
"VBA 프로그램 , 엑셀 매크로 제작해 드립니다.",데이터,2219.0,스마트dda,프로그램 유지보수
"카페24,그누보드,영카트 홈페이지 제작 수정 유지보수해 드립니다.",홈페이지,2221.0,꼼꼼한훈이,웹 유지보수
퀄리티 높은 modoo 모두 홈페이지 제작해 드립니다.,홈페이지,2225.0,Udesigns,웹 제작
HTML CSS 저렴한 가격으로 홈페이지 수정해 드립니다.,홈페이지,2230.0,부람쥐얼쑤,웹 유지보수
카페24 쇼핑몰 수정 및 작업 서비스,커머스,2231.0,김단웹,웹 제작
어떤 웹페이지든 고쳐 드립니다.,홈페이지,2232.0,부리부리,웹 제작
17년경력 VBA 이용하여 매크로 레포트 등 만들어 드립니다.,기타,2233.0,EBConsulting,프로그램 자동화
구글애널리틱스 ga 이론부터 8가지 분석법까지 드립니다.,프로그램,2234.0,KLab,액셀.스프레드시트
깔끔하고 맛있는 코딩 홈페이지 웹퍼블리싱해 드립니다.,홈페이지,2236.0,웹코기,웹 유지보수
"JSP,PHP,HTML 간단한 소스코드 수정, 제작해 드립니다.",홈페이지,2240.0,비트박,웹 유지보수
트레이딩뷰 파인스크립트 보조지표 제작해 드립니다.,프로그래밍,2242.0,Ilgaemi,프로그램 자동화
반응형퍼블리싱 전문가 최적의 작업물을 약속드립니다.,홈페이지,2243.0,퍼블제이,웹 유지보수
바른 워드프레스 설치와 함께 입문을 도와 드립니다.,홈페이지,2244.0,angelBoy,웹빌더
페이스북 픽셀 설치해 드립니다.,기타,2246.0,최초개척자,하드웨어·임베디드
홈페이지 및 쇼핑몰 수정해 드립니다.,커머스,2248.0,mutangood,웹 제작
웹모바일 웹반응형 퍼블리싱해 드립니다.,홈페이지,3920.0,호랭2,웹 유지보수
웹크롤링 자동화 크롤러 프로그램 시원하게 만들어 드립니다.,데이터,2256.0,최현오,웹빌더
포털 사이트 키워드 검색량 일별로 추출 및 분석해 드립니다.,프로그램,5109.0,아하데이터랩,데이터 전처리.분석.시각화
카페24 쇼핑몰 수정해 드립니다.,커머스,2258.0,Bubblegum,웹 제작
눈에 보이는 웹 데이터 크롤러 제작해 드립니다.,데이터,2259.0,끈질긴블랙,웹 제작
웹 페이지의 모든 업무를 매크로로 제작해 드립니다,홈페이지,2307.0,PROMYS,웹 제작
"하이브리드 앱, 앱 패키징 작업해 드립니다.",모바일,2262.0,Loonix,앱
뜯어보면서 공부할 수 있는 게임 기능을 만들어드립니다.,게임,2263.0,윤스톤,게임·AR·VR
인터넷 데이터를 수집해드립니다. 웹데이터 크롤링,데이터,2265.0,워크프리,크롤링.스크래핑
프로그램 빠르게 개발해 드립니다.,프로그램,2268.0,민그리머,프로그램 유지보수
안드로이드 iOS 앱 가성비 있게 만들어 드립니다.,모바일,4255.0,에단Dev,앱
윈도우 프로그램 제작해 드립니다.,프로그램,2270.0,드루와,프로그램 유지보수
홈페이지 그누보드 영카트 수정해 드립니다.,홈페이지,2272.0,느릿느릿해결사7167,웹 유지보수
"논문통계, 통계분석, 학술통계 전문가입니다",데이터,2273.0,통계마스터,데이터 전처리.분석.시각화
"워드프레스 쇼핑몰, 홈페이지 유지보수해 드립니다.",커머스,2274.0,디옹,웹 제작
HTML5 CSS JS 웹 퍼블리싱 해 드립니다.,홈페이지,2275.0,jinfunction,웹 유지보수
서버 이전작업 도와 드립니다.,데이터,2276.0,아바에스,서버.클라우드
"리눅스 기술지원, 장애처리, 서버이전, 서버구축",데이터,2277.0,시스픽스,서버.클라우드
"반응형의 최적화된 이북제작, 웹북제작, 이북샘플확인",홈페이지,2278.0,피오디존,웹 제작
"구글 스프레드시트 엑셀 매크로 , 프로그램 개발 제공해 드립니다.",데이터,2280.0,ExcelGo,액셀.스프레드시트
모두홈페이지 제작 해 드립니다.,홈페이지,2282.0,wetogether,웹 제작
"그누보드, php, api, 유지보수 도움을 드립니다.",기타,2283.0,카인1,웹 유지보수
아두이노 라즈베리파이 시제품 제작해 드립니다.,프로그래밍,2284.0,돌마,하드웨어·임베디드
자바계열 프로그램 버그 수정해 드립니다.,프로그램,2290.0,Botbinoo,프로그램 유지보수
카페24센스있는소통과 8년간의노하우로 코딩 도와드립니다,기타,3622.0,언폴드,코딩
구글 스프레드시트 엑셀 자동화 시스템 맞춤 제작 서비스,데이터,2292.0,블루오션발굴단,액셀.스프레드시트
머신러닝 딥러닝을 이용한 데이터 분석 전과정을 모델링해 드립니다.,데이터,2293.0,mok348,머신러닝 딥러닝
"PHP ASP 보완, 수정, 오류 도와 드립니다.",기타,2294.0,라곰,웹 유지보수
"홈페이지 디자인부터 퍼블리싱, 프론트엔드 개발까지",홈페이지,2295.0,나무랑,웹 유지보수
WIX 윅스로 홈페이지 제작해 드립니다.,홈페이지,2296.0,BrownKIM,웹 제작
PHP 웹 사이트 유지보수를 책임져 드립니다.,홈페이지,2297.0,논픽션Lover,웹 유지보수
통계 분석 및 AI/ML 모델링 진행해 드립니다.,데이터,2299.0,olleh,데이터 전처리.분석.시각화
웹인터넷에서 하는 모든 작업을 하는 매크로를 만들어 드립니다.,홈페이지,2300.0,AutomationKim,웹빌더
SPSS AMOS 논문통계 박사 전문가가 직접 분석해 드립니다.,데이터,2302.0,알앤엘,데이터 전처리.분석.시각화
사업에 무조건 도움 되는 반응형 홈페이지 제작해 드립니다.,홈페이지,4621.0,원스홈페이지,웹 제작
간단한 프로그래밍 코딩 도와드립니다,프로그래밍,2304.0,ehjang,코딩
윈도우 가상서버 가상PC 월단위 임대해 드립니다.,데이터,2305.0,시스픽스,블록체인·NFT
간단하고 쉽고 빠른 홈페이지 제작해 드립니다.,홈페이지,2306.0,로신코리아,웹 제작
글로벌 전세계 출시 수익형 모바일 2D게임 제작,게임,2309.0,게임드림,게임·AR·VR
"홈페이지 제작,수정,유지보수 웹퍼블리셔 10년차가 드립니다.",홈페이지,2310.0,밥알미디어,웹 유지보수
"SQL 쿼리 개발, 데이터모델링을 해 드립니다.",데이터,2311.0,친절한전문가에요,데이터베이스
PC 온라인 원격포맷해 드립니다.,프로그래밍,2417.0,RCPC,기타
자동화 매크로 프로그램을 제작해드립니다.,프로그램,2315.0,언어공작소,프로그램 자동화
파이썬 c 코딩 이 한 몸 바쳐 도와 드립니다.,프로그래밍,2318.0,낯선소년,코딩
카페24쇼핑몰 전문 무엇이든 해 드립니다.,커머스,2319.0,YiJH,웹 제작
PHP HTML 기능 개선 및 수정해드립니다.,홈페이지,2328.0,유웅디,웹 유지보수
C C Java MFC C WPF 프로그램 개발해 드립니다.,프로그램,2329.0,감동프로그래머,프로그램 유지보수
아두이노 라즈베리파이로 시제품 제작해 드립니다.,프로그래밍,2331.0,만들남,하드웨어·임베디드
SOROOM 10년 경력 전문가가 홈페이지를 제작해 드립니다.,홈페이지,2332.0,soroom,웹 제작
"PHP 개발 , 유지보수해 드립니다.",프로그래밍,2334.0,ddalgiyalove,웹 유지보수
"엑셀을 활용한 함수,서식, VBA 자동화 매크로 제작해 드립니다.",데이터,2335.0,코딩하는룡룡이,프로그램 자동화
카페24 수정 기능추가 유지보수 및 제작해 드립니다.,프로그래밍,2336.0,요니쪼Design,웹 유지보수
"개발20년 ASP,PHP,JSP 유지보수해 드립니다.",프로그래밍,2337.0,flyweb,웹 유지보수
카페 24 수정 유지보수 해 드립니다.,기타,2339.0,Leeselin,웹 유지보수
워드프레스 버그 수정해 드립니다.,홈페이지,2343.0,워드넷,웹빌더
간단한작업 당일수정가능 홈페이지 수정해 드립니다.,홈페이지,2344.0,Piart,웹 유지보수
데이터 분석/ML/AI Modeling 개발해 드립니다,데이터,2350.0,슬기로운수박6802,크롤링.스크래핑
홈페이지수정 작업해 드립니다.,홈페이지,2351.0,J마케터,웹 유지보수
깔끔하게 웹퍼블리싱해 드립니다. 홈페이지 웹사이트,홈페이지,2352.0,첫인상프로젝트,웹 유지보수
상상하고 계획만했던 그 생각을 프로그램으로 탄생시켜 드립니다.,프로그램,2353.0,빈프로젝트,프로그램 유지보수
카페24 스마트스토어 메이크샵 배너 및 세팅,기타,2354.0,618디자인,기타
쇼핑몰에 카페24등 SNS 로그인 6종 연동해 드립니다,커머스,2359.0,kbs,웹 제작
"웹 퍼블리싱 PC, 모바일, 반응형 작업해 드립니다.",홈페이지,2360.0,TW,웹 유지보수
데이터 분석 및 시각화 리포트를 깔끔하게 작성해 드립니다.,데이터,2361.0,데이터전재,크롤링.스크래핑
쇼핑몰배너 상세페이지 온라인배너 제작해 드립니다.,커머스,2363.0,궁봇,웹 제작
"워드프레스 모바일,웹 반응형 홈페이지,사이트 제작해 드립니다.",홈페이지,2364.0,넘버원아이템,웹 제작
카페24 쇼핑몰 수정 해 드립니다.,커머스,2367.0,네오웨이,웹 제작
사용중인 홈페이지 수정해 드립니다.,홈페이지,2368.0,helppurpleK9,웹 유지보수
"페이스북 픽셀 설치, 서울대 출신 개발자가 완벽하게.",프로그래밍,2369.0,서울넘버풀,하드웨어·임베디드
컴퓨터 조립 및 대행 업그레이드 견적제작 해드립니다.,프로그래밍,2370.0,우장춘박사,하드웨어·임베디드
"리눅스, 윈도우 서버 장애처리, 서버이전해 드립니다.",데이터,2372.0,RoOt,서버.클라우드
아마존 클라우드 서버를 활용한 웹 서버 기술지원을 해 드립니다.,홈페이지,2373.0,조교,서버.클라우드
MATLAB 훌륭하게 만들어 드립니다.,기타,2374.0,전세영,기타
AWS / Linux / 오픈소스 기술 지원 드립니다.,기타,3492.0,풍요로운수달,AI.GPT
매일 하시는 반복업무 버튼으로 만들어 드립니다.,기타,2377.0,Excelerated데이터솔루션,프로그램 자동화
웹 모바일 퍼블리싱 반응형 퍼블리싱 해 드립니다.,홈페이지,2378.0,조아웹,웹 유지보수
모든 SQL 쿼리 개발 및 전환 을 도와 드립니다.,프로그래밍,2379.0,database전문가,데이터베이스
"카페24,고도몰,메이크샵 쇼핑몰 수정 및 유지보수 전문",커머스,2381.0,STUDIOVIE,웹 유지보수
웹사이트 쇼핑몰 수정해 드립니다.,커머스,2383.0,민쿠니,웹 제작
"카페24, 고도몰, 영카트 등 쇼핑몰 수정 및 개선 해 드립니다.",커머스,2384.0,코어에스앤씨,웹 제작
논문 통계/데이터 분석 도와드립니다.,데이터,2387.0,감미로운아도니스4063,크롤링.스크래핑
"웹사이트 수정, 개선, 개발해 드립니다.",홈페이지,2388.0,webking,웹 유지보수
"회로 설계, PCB 제작, 아두이노, 3D 프린팅",프로그래밍,2390.0,이즈Circuit,웹 제작
C언어 프로그래밍을 해 드립니다.,프로그래밍,2392.0,C튜토리얼,번역·언어 서비스
통계데이터 분석 및 시각화를 성실하게 해 드립니다.,데이터,2393.0,shlee1990,크롤링.스크래핑
워드프레스 홈페이지제작 50DC 포트폴리오 빠른수정해 드립니다.,홈페이지,2394.0,워드프레스메가파운튼,웹 제작
파이썬 프로그래밍해 드립니다.,프로그래밍,2395.0,터렛짓는다,코딩
카카오먼트 픽셀 설치 도와 드립니다.,기타,2397.0,개밥그릇,하드웨어·임베디드
"React, Html 웹 페이지 제작 전문 프론트엔드",홈페이지,2399.0,임쁘띠,웹 제작
홈페이지 제작 및 수정 기능추가해 드립니다.,홈페이지,2400.0,디제이솔루션,웹 제작
홈페이지 퍼블리싱 작업이나 수정해 드립니다.,홈페이지,2401.0,Notbad,웹 유지보수
"PDF파일을 편집, 수정, 변환해 드립니다.",기타,2403.0,디자인20,웹 유지보수
반응형 퍼블리싱 바르게 제작해 드립니다.,홈페이지,2405.0,바른퍼블리싱,웹 유지보수
통계 분석 서비스 해 드립니다.,데이터,2408.0,푸르른아침,데이터 전처리.분석.시각화
html css jquery홈페이지 수정해 드립니다.,홈페이지,2411.0,준오네,웹 유지보수
기획력있는 퍼블리싱 해 드립니다.,기획,2412.0,기발한기발자,직무직군
홈페이지 수정 및 유지보수해 드립니다.,홈페이지,2414.0,티타임75,웹 유지보수
모두 moodoo 로 홈페이지 만들어 드립니다.,홈페이지,2416.0,키리츠레,웹 제작
웹사이트 개발 유지 보수 책임지고 완료해 드립니다.,홈페이지,2419.0,꿀덩이,웹 유지보수
"HTML, CSS, JQuery 퍼블리싱 수정해 드립니다.",홈페이지,2421.0,PublisherSAN,웹 유지보수
카페24 쇼핑몰 수정 및 추가작업 해 드립니다.,커머스,2422.0,핏츠디자인,웹 제작
"아두이노,라즈베리파이,기타 MCU 기능, 장치를 개발해 드립니다.",프로그래밍,2423.0,JC12,하드웨어·임베디드
간단한 프로그래밍 도와 드립니다.,프로그래밍,2426.0,러쎌,코딩
디스코드 서버를 맞춤 제작해 드립니다.,데이터,2427.0,이수혁,서버.클라우드
"고도몰,카페24 등 쇼핑몰 수정 드립니다.",커머스,2428.0,loben39028,웹 제작
퀄리티 높은 매크로 제작해 드립니다.,프로그래밍,2430.0,민트초코컴퓨터,프로그램 자동화
엑셀의 함수 수식차트VBA등을 이용한 관리프로그램만들어 드립니다.,데이터,2434.0,소금토스트,액셀.스프레드시트
카페24 홈페이지 쇼핑몰 제작해 드립니다.,커머스,2435.0,슈징코,웹 제작
"워드프레스 기능 추가, 수정, 개선 해 드립니다.",홈페이지,2436.0,셀크리즈,웹빌더
데이터사이언스 박사의 데이터 분석 서비스 드립니다.,데이터,2438.0,데이터사이언스박사,크롤링.스크래핑
카페24 쇼핑몰 이미지 링크 텍스트 수정 도와 드립니다.,커머스,2440.0,유진벨라,웹 제작
PHP 프로그램 개발해 드립니다.,프로그램,2645.0,디버스,프로그램 유지보수
안드로이드 어플리케이션을 개발해 드립니다.,프로그래밍,2442.0,아코,앱
간단한 안드로이드 앱 만들어 드립니다.,모바일,2443.0,Franny,앱
AWS 기술지원해 드립니다.,기타,2446.0,MasterONE,컴퓨터 기술지원
PDF 다양한 편집을 해 드립니다.,기타,2448.0,케세라세라,기타
"C/C++ 개발, 코드 분석 및 디버깅",프로그램,2451.0,김버퍼,웹 유지보수
가상화폐 코인 보조지표 맞춤 제작해드립니다.,프로그래밍,3608.0,이플랩,블록체인·NFT
"PC,MOBILE 반응형 웹 퍼블리싱 및 유지보수해 드립니다.",홈페이지,2455.0,OhSung,웹 유지보수
카페24 메이크샵 쇼핑몰 유지 보수해 드립니다.,커머스,2456.0,IT마스터,웹 제작
NodeJS로 서버 개발/수정해 드립니다.,데이터,2457.0,먹또넴,웹 유지보수
스피드하게 윅스 홈페이지 만들어 드립니다.,홈페이지,2459.0,제이군마케팅,웹빌더
"도메인 연결, 도메인 주소로 끝나는 기업이메일 세팅해 드립니다.",기타,4174.0,모자이크맨,기타
당신의 웹 사이트에 기능을 추가해 드립니다.,홈페이지,2461.0,rigelko,웹빌더
워드프레스 홈페이지제작 포트폴리오 빠른 제작해 드립니다.,홈페이지,2462.0,워드프레스메가파운튼,웹 제작
"C언어, 파이썬, 웹 프로그래밍, 프로젝트도와드립니다.",홈페이지,2465.0,rigelko,코딩
"빠르고 정확한 퍼블리싱, 원하시는 웹 그대로 해 드립니다.",홈페이지,2466.0,야근하는손가락,웹 유지보수
Native Android 과 Flutter 앱 개발해 드립니다.,모바일,2467.0,코딩머신,앱
VBA 막힐 때 물어보세요,기타,3555.0,연봉백억,기타
클라우드 리눅스 윈도우 구축 이전 장애처리 기타 모두해 드립니다.,기타,2469.0,아이티아라,서버.클라우드
반응형 퍼블리싱해 드립니다.,홈페이지,2474.0,DevelopersUFO,웹 유지보수
"엑셀 문서 작성해드립니다. VBA,매크로,파워쿼리",데이터,5649.0,엑셀로칼퇴,액셀.스프레드시트
"커뮤니티, 기업 홈페이지를 제작해 드립니다.",홈페이지,2478.0,PETORI,웹 제작
홈페이지 퍼블리싱해 드립니다.,홈페이지,2481.0,에이지,웹 유지보수
Python과 R로 데이터 분석해 드립니다.,데이터,2482.0,데분데분,크롤링.스크래핑
"홈페이지 수정, 이미지 및 텍스트 등 간단 수정",홈페이지,2483.0,YaaP,웹 유지보수
API 서버 및 프론트 화면 개발/수정 해 드립니다.,데이터,2484.0,알바몽,웹 유지보수
화면 디자인까지 홈페이지 제작해 드립니다.,홈페이지,2486.0,homek,웹 제작
반응형 퍼블리싱 해 드립니다.,홈페이지,2490.0,DarkBrowine,웹 유지보수
간단한 페이지 개발 및 수정 작업 진행해 드립니다.,프로그래밍,2491.0,성실하고꼼꼼한개발자,웹 유지보수
고도몰5 튜닝과 패치를 진행해 드립니다.,기타,2493.0,고도몰5튜닝패치,웹 제작
문구 및 이미지 수정 또는 기능 추가 및 유지 보수,기타,2494.0,재택만가능합니다,웹 유지보수
