서비스명,대분류,서비스번호,판매자,소분류
정보성키워드 쇼핑키워드 대량수집 프로그램 드립니다.,프로그램,3279.0,무극선인,데이터 구매
HW 회로도 아트웍 펌웨어 양산 필드 피드백 드립니다.,기타,3281.0,안알아,기타
iOS아이폰 앱 개발 해드립니다.,모바일,3284.0,소코아,앱
"웹 그누보드 영카트 기능개선, 오류수정 웹개발 작업해 드립니다.",홈페이지,3285.0,ReactNext,웹 유지보수
"MS 관련 Server, Hyper V 관련 기술지원",기타,3287.0,KSEM,컴퓨터 기술지원
카페24쇼핑몰 UIUX 수정해 드립니다.,커머스,3288.0,호빵사세요,웹 제작
웹 퍼블리싱 반응형 가능 꼼꼼하게 작업해 드립니다.,홈페이지,3290.0,수잡,웹 유지보수
쇼핑몰 키워드 랜덤조합 기능 엑셀파일 드립니다.,데이터,3292.0,ExcelFit,웹 제작
부동산 분양 전문 맞춤형 홈페이지를 제작해 드립니다.,홈페이지,3293.0,쭈니쭈니입니다,웹 제작
"JSP,JAVA,PHP,ASP 웹프로그램 개발해 드립니다.",프로그램,3294.0,리얼마니,웹 유지보수
중국만리 방화벽에서 사용가능한 IKEv2 VPN 서버 셋팅해 드립니다.,데이터,3295.0,늘산,서버.클라우드
워드프레스 기능 추가 및 유지보수해 드립니다.,홈페이지,3297.0,제이날다,웹빌더
워드프레스 전문가가 반응형 사이트를 구축해 드립니다.,홈페이지,3298.0,루코,웹빌더
"빅데이터 전처리 , 크롤링 , 공공데이터 수집해 드립니다.",데이터,3299.0,종버버버,크롤링.스크래핑
주식 정보 봇 대여해 드립니다.,기타,3300.0,민그리머,봇.챗봇
"퍼블리싱, 웹 앱 개발해 드립니다.",모바일,3301.0,10xDeveloper,웹 유지보수
자연어 처리 프로그램 개발해 드립니다.,프로그램,3302.0,DPipe,컴퓨터 비전.자연어 처리
홈페이지제작 워드프레스 웹사이트제작해 드립니다.,홈페이지,3303.0,홈페이지지음,웹 제작
스마트스토어 자동 최저 가격 관리 프로그램 가격비교,프로그램,3304.0,인터넷쇼핑몰전문가,프로그램 자동화
자신의 앱 웹 사이트가 보안 위협에 안전한지 확인해 드립니다.,모바일,3305.0,비트박,앱
엑셀 자동화의 달인 - AWS 클라우드 기반 가능,데이터,3307.0,BotMaker,액셀.스프레드시트
인스타그램 해시태그 크롤링 대량으로 수집해 드립니다.,데이터,3308.0,빵천리서치,크롤링.스크래핑
"디자인된 페이지를 코딩, 퍼블리싱, 퍼블리셔 및 개발해 드립니다.",디자인,3309.0,코딩해줘,웹 유지보수
모든 데이터 처리 작업해드립니다.,데이터,3311.0,Intrium,크롤링.스크래핑
"PHP,ASP 홈페이지 수정, 개발해 드립니다.",홈페이지,3312.0,원z,웹 유지보수
간단한 워드프레스 블로그 또는 웹사이트 예쁘게 만들어 드립니다.,홈페이지,3313.0,PJW48,웹빌더
반응형 홈페이지 퍼블리싱 해드립니다,홈페이지,3314.0,프롬마스,웹 유지보수
원하시는 python 프로그램 제작해 드립니다.,프로그램,3320.0,jwill,프로그램 유지보수
"SQL튜닝, DB설계, 튜닝교육,DB부하 개선해드립니다",기타,3322.0,김영군,웹 제작
워드프레스 수정 유지보수 해 드립니다.,홈페이지,3325.0,웹개발자입니다,웹 유지보수
구글 애드센스 수익형 워드프레스 블로그 제작해 드립니다,홈페이지,3328.0,최사장c,액셀.스프레드시트
"카페24 쇼핑몰 수정, 관리해 드립니다.",커머스,3329.0,dodesignsy,웹 제작
임베디드 프로젝트 설계 상담 및 제작해 드립니다.,프로그래밍,3330.0,진메이커,하드웨어·임베디드
안드로이드 앱 빠르고 꼼꼼하게 개발해 드립니다.,모바일,3331.0,SSSDeveloper,앱
"카페24,고도몰 텍스트, 이미지, 링크 수정해 드립니다.",기타,3332.0,플레이브,웹 유지보수
디스코드 봇 개발해 드립니다.,프로그래밍,3333.0,dlwlgur,봇.챗봇
파이썬 코드 오류 잡아 드립니다.,프로그래밍,3334.0,papig,코딩
JSP 웹 사이트 기능 개선 및 수정,홈페이지,3335.0,국가기관웹개발자,웹 유지보수
기획부터 디자인 개발까지 완벽한 반응형홈페이지 제작해 드립니다.,홈페이지,3336.0,디자인스튜디오래스,웹 유지보수
카페24 온라인 쇼핑몰 수정 및 유지보수해 드립니다.,커머스,3337.0,Taylormin,웹 유지보수
제안서 모음.zip,기타,3338.0,MasterPlanner,기타
"HTML, CSS, JS, JQuery 웹사이트 수정해 드립니다.",홈페이지,3339.0,개발자에스더,웹 유지보수
웹 크롤링 및 크롤링 프로그램 제작해 드립니다.,데이터,3340.0,디셉디콘,웹 제작
윈도우프로그램 제작하여 드립니다.,프로그램,3341.0,초심개발자,프로그램 유지보수
php 웹 기능추가 및 수정해 드립니다. 그누보드 가능,홈페이지,3343.0,쏘쏘쏘,웹 유지보수
SQL Query 개발을 해 드립니다.,프로그래밍,3344.0,SQL Server DBA,웹 유지보수
업무자동화 매크로 프로그램 개발해 드립니다.,프로그램,3345.0,자동화마스터,프로그램 자동화
꼼꼼히 의사소통하며 최고의 Android 앱개발해 드립니다.,모바일,3348.0,꼬미애비,앱
웹사이트 크롤링 해 드립니다.,데이터,3349.0,우르릉,크롤링.스크래핑
"HTML,CSS, JQuery 웹사이트 수정해 드립니다",홈페이지,3350.0,웹개발최프로,웹 유지보수
"인스타그램 데이터 크롤링, 수집, 추출 완벽하게 해 드립니다.",데이터,3351.0,LazyMarketer,크롤링.스크래핑
웹사이트 개발 유지보수해 드립니다.,홈페이지,3352.0,고독한회사원,웹 유지보수
식스샵 six shop 으로 홈페이지 제작해 드립니다.,홈페이지,3353.0,슈징코,웹 제작
간단한 아두이노 코딩 해드립니다,기타,3354.0,gaedoo,하드웨어·임베디드
적응형/반응형 웹퍼블리싱 작업해드립니다,홈페이지,3355.0,sallyP,웹 유지보수
"문서, 이미지, pdf 에서 글자 추출, 인식해 드립니다.",데이터,3356.0,DocumentService,기타
WIX윅스 가성비 홈페이지 빠르고 퀄리티있게 제작해 드립니다.,홈페이지,3357.0,용용기획,웹 제작
"안드로이드, iOS 네이티브 앱 제작하여 드립니다.",모바일,3358.0,yydevteam,앱
"고객 맞춤 반응형 웹사이트,홈페이지 제작해 드립니다.",홈페이지,3359.0,tgDeveloper,웹 제작
Java 버그 수정 및 소스코드 짜 드립니다.,기타,3360.0,엘스부,웹 유지보수
"""개발 공부 전 필독"" IT 서비스 기본 개념 Ebook을 드립니다.",프로그래밍,3361.0,DDAAC,웹 유지보수
웹페이지 퍼블리싱 HTML CSS javaScript 빠르고 정확한 작업 제공해 드립니다.,홈페이지,3363.0,고슴도지,웹 제작
워드프레스 홈페이지 보안을 제대로 강화 시켜 드립니다.,홈페이지,3364.0,제이케이스튜디오,웹빌더
HTML CSS JS 퍼블리싱 반응형 제작해드립니다.,홈페이지,3365.0,hyemong,웹 유지보수
어떤 프로그램이든 만들어 드립니다.,프로그램,3368.0,덕이더기,프로그램 유지보수
다양한 프로그램을 만들어 드립니다,프로그램,3372.0,AZDEV,프로그램 유지보수
카페24 쇼핑몰 A부터 Z까지 모두 도와드립니다,커머스,3373.0,뽀뽀,웹 제작
의뢰자님의 앱 아이디어를 현실로 이루어 드립니다.,모바일,3375.0,코딩하는썸머,앱
Vue React HTML JS CSS 작업 해드립니다,홈페이지,3376.0,끈질긴사과1071,기타
"플러터로 iOS,AOS 앱 깔끔하게 만들어 드려요.",모바일,3377.0,스몰아이즈,앱
운영중이신 식스샵 페이지 리뉴얼 및 수정해 드립니다.,기타,3378.0,누누NUNU,웹 유지보수
"아임웹 수정,간단한 작업,퀄리티 있게 작업해 드립니다.",홈페이지,3379.0,1D1Y,웹빌더
프론트엔드 및 백엔드 유지보수 해 드립니다.,기타,3380.0,suu2,직무직군
퍼블리싱의 모든것 신속하고 정확하게 지원해 드립니다,홈페이지,3381.0,Atlas,웹 유지보수
반응형 쇼핑몰 커머스 웹사이트 앱 개발해 드립니다.,모바일,3382.0,DesignerTEO,웹 제작
"웹 크롤링, 스크래핑해 드립니다.",데이터,3385.0,스크롤링롤링롤링,웹빌더
웹페이지 크롤링 및 OpenAPI 데이터 수집하여 드립니다.,데이터,3387.0,Z스타9224,크롤링.스크래핑
리액트 React JS / Native 앱 개발,모바일,3388.0,핑크펜더,앱
웹사이트 퍼블리싱 해 드립니다.,홈페이지,3389.0,개발자강팀장,웹 유지보수
꼼꼼하고 빠르게 맞춰드리는 #퍼블리싱 #반응형 #웹표준,홈페이지,4863.0,굿바이플래시,기타
그누보드 영카트 기반 홈페이지 수정/제작,홈페이지,3395.0,브래딤,웹 제작
윈도우 업무프로그램 개발해 드립니다.,프로그램,3397.0,수정수3,프로그램 유지보수
React 웹 사이트 꼼꼼하게 개발해 드립니다.,홈페이지,3398.0,비락식혜,웹 유지보수
유니티 3D / 2D 포트폴리오용 및 상용화 게임 제작,디자인,3402.0,동동e,게임·AR·VR
APP UI 디자인 게임UI 게임아이콘 제작해 드립니다.,디자인,3403.0,BurnaLee,게임·AR·VR
"NFT, 3D캐릭터, 민팅사이트 제작을 도와 드립니다.",프로그래밍,3404.0,해로웃탸,웹 제작
웹페이지 프론트엔드 제작 및 퍼블리싱해 드립니다.,홈페이지,3405.0,엔지니어064,웹 제작
원하시는 기능으로 쇼핑몰 제작해 드립니다.,커머스,3406.0,똘맹,웹 제작
iOS 안드로이드 앱패키징 개발해 드립니다.,모바일,3407.0,용산집,앱
라즈베리파이 아두이노 프로젝트 도와 드립니다.,기타,3408.0,무선통신,하드웨어·임베디드
기존 모바일웹페이지를 앱으로 제작 해 드립니다.,모바일,3409.0,스테퍼스,웹 제작
"웹 유지보수 및 개선, 수정, 기능추가를 해 드립니다.",홈페이지,3410.0,GanziMan,웹 유지보수
조건검색식 연동 자동매매프로그램 만들어 드립니다.,프로그램,3414.0,최지웅123,프로그램 자동화
데이터를 원하는 형태로 데이터 가공해 드립니다.,데이터,3416.0,아루미썰,크롤링.스크래핑
Android 앱 버그 수정 및 기능개선 해 드립니다.,모바일,3417.0,가시사과,앱
이 개발자는 고객이 필요로하는 프로그램을 개발해 드립니다.,프로그램,3418.0,JFlex,프로그램 유지보수
RPA 매크로 모든 반복 업무 자동화 제작해 드립니다.,프로그래밍,3419.0,AutoAdmin,프로그램 자동화
미리보기 및 시안을 받아보실 수 있는 홈페이지 제작,홈페이지,3421.0,에티스,웹 제작
관심종목에 대한 공시를 메신저로 알려주는 프로그램 드립니다.,프로그램,3422.0,무극선인,프로그램 유지보수
컴퓨터안의 컴퓨터 가상컴퓨터운영체제 설치해 드립니다.,기타,3423.0,NDesign,하드웨어·임베디드
드롭박스 무료 플랜 용량 추가 총 18GB 해 드립니다.,기타,3424.0,How2Play,기타
카페24 쇼핑몰 디자인 기능 개선 작업을 도와 드립니다.,커머스,3425.0,버디랩,웹 제작
"간단한 Android, IOS 앱 만들어 드립니다.",모바일,3426.0,랩마스터,앱
키워드별 순위확인 순위체크 솔루션 제공해 드립니다.,기타,3427.0,토리토시스템,기타
PCB설계및 시제품 제작해 드립니다.,프로그래밍,3428.0,여주태,웹 제작
관리가 쉬운 홈페이지를 제작해 드립니다.,홈페이지,3430.0,ZEPETO,웹 제작
"사이트 제작, 사이트 디자인, 웹표준코딩, 반응형웹 , 커스터마이징 해 드립니다.",홈페이지,3431.0,MAD,웹 제작
GA4구글 애널리틱스 설치 해 드립니다.,기타,3432.0,minet,액셀.스프레드시트
"문서, 웹, 매크로 자동화 프로그램을 개발해드립니다.",프로그램,3435.0,jerife,웹 유지보수
보안취약점 제거 및 시큐어코딩 적용,기타,3436.0,지오GIO,기타
PHP 그누보드 개발자 도움 드립니다.,프로그래밍,3438.0,php,기타
웹 관리자 프로그램 개발해 드립니다.,프로그램,3439.0,웹에이블,웹 유지보수
워드프레스 테마 빌더 스타터 패키지 설치 및 교육해 드립니다.,홈페이지,4328.0,하시인,웹빌더
홈페이지제작 워드프레스 홈페이지 반응형 제작해드립니다,홈페이지,3441.0,슬로아,웹 제작
24시간 컷 웹 퍼블리싱,홈페이지,3442.0,DH테크,웹 유지보수
"엑셀 VBA, 파이썬을 통한 사무업무자동화 개발",데이터,3443.0,Inhandslife,액셀.스프레드시트
웹의 원하는 모든 정보를 자동으로 추출해드립니다.,홈페이지,3446.0,isakDev,웹빌더
반응형 홈페이지제작 랜딩페이지 맞춤형 웹사이트제작,홈페이지,3447.0,브랜디어,웹 제작
Python을 활용한 데이터 분석 도와 드립니다.,데이터,3448.0,박군,크롤링.스크래핑
각종 랜딩페이지 웹플로우로 에 제작해드립니다.,홈페이지,3449.0,랜딩페이지제작,웹 제작
메타버스 게더타운 월드맵 구성 및 제작해 드립니다.,프로그래밍,3450.0,Mickycci,웹 제작
"간단한 웹사이트부터 고급 개발까지디자인,퍼블,개발",홈페이지,3451.0,ckhan,웹 유지보수
"웹/앱, 반응형으로 최적화 된 홈페이지 제작해드립니다.",모바일,3452.0,문유정,웹 제작
아임웹으로 깔끔한 사이트 제작해 드립니다.,홈페이지,3453.0,갓디노,웹빌더
웹 사이트 퍼블리싱 작업 해드립니다.,홈페이지,4435.0,동그리동글,웹 유지보수
HTMLJavaScriptbackend 수정해 드립니다,홈페이지,3456.0,요즘은행복한갈치7462,웹 유지보수
반응형 홈페이지 맞춤으로 제작해 드립니다.,홈페이지,3458.0,illyweb,웹 제작
웹표준 모바일웹 반응형웹 퍼블리싱 해 드립니다.,홈페이지,3460.0,Chodesigner,웹 유지보수
반응형 SEO 기획 맞춤 홈페이지 제작해 드립니다,홈페이지,3462.0,디자인하이브,웹 제작
모바일 네이티브앱을 개발해 드립니다.,모바일,3464.0,포인트폰,웹 유지보수
"로열티 설정 가능한 이더리움, 폴리곤 NFT 개발",프로그래밍,3466.0,nftprime,웹 유지보수
1인샵 미용실 네일샵 고객관리프로그램 엑셀 양식 드립니다.,데이터,3468.0,엑셀마왕,프로그램 유지보수
"카카오 픽셀 설치, 서울대 출신 개발자가 완벽하게",프로그래밍,3469.0,서울넘버풀,하드웨어·임베디드
쇼핑몰 홈페이지 개선해 드립니다.,커머스,3470.0,워드넷,웹 제작
데스크탑 컴퓨터 또는 노트북 수리 및 점검해 드립니다.,기타,3471.0,궁구미,하드웨어·임베디드
홈페이지 기획 제작 디자인 관리 미니홈페이지 제작,홈페이지,4862.0,에버브리즈,웹 제작
"안드로이드,아이폰,하이브리드 앱 및 웹 개발해 드립니다",모바일,3474.0,빅토리아 모바일,앱
"홈페이지, 쇼핑몰의 간단한 수정 변경을 맡겨주세요",커머스,3475.0,피클웹,웹 제작
어떤 파일이든 변환해 드립니다.,기타,3476.0,심심한아리엘,기타
"꼼꼼하게 홈페이지 유지보수,기능수정 및 추가해 드립니다",홈페이지,3478.0,minigo,웹 유지보수
"PHP 웹사이트 기능 추가, 수정, 유지보수해 드립니다.",홈페이지,3480.0,송도리,웹 유지보수
"웹표준 당일가능, 빠르고 정확하게 최적화 퍼블리싱해 드립니다.",홈페이지,3481.0,지네,웹 유지보수
웹 사이트를 개발/유지보수 해 드립니다.,홈페이지,3482.0,달이형아,웹 유지보수
전공자가 아임웹을 통해 홈페이지 제작해 드립니다.,홈페이지,3485.0,Bostrom,웹 제작
반응형 이러닝 LMS 사이트 홈페이지 제작해 드립니다.,홈페이지,3486.0,공부나라,웹 제작
게임아이콘스토어등록 스크린샷디자인 프로모션동영상 제작해 드립니다.,디자인,3487.0,게임드림,게임·AR·VR
"업무자동화,크롤링 모든 비효율을 파괴해 드립니다.",데이터,3488.0,에센셜리스트,프로그램 자동화
홈페이지 유지보수를 해 드립니다.,홈페이지,3490.0,KDJ,웹 유지보수
"입사일, 회계일기준으로 계산 있는 연차관리엑셀프로그램",데이터,3491.0,꿈이룸2022,재무·회계
금융인프라ISMS인증대비 보안설계 구축해 드립니다.,기타,3493.0,12년차데브옵스,직무직군
웹 데이터 수집 또는 수집 프로그램 제작해 드립니다.,데이터,3495.0,최지웅123,웹 제작
기업 펜션 원페이지 쇼핑몰 반응형홈페이지 제작드립니다.,커머스,3496.0,황금미디어,웹 제작
이더리움 토큰 ERC-20 / 721 / 1155개발,프로그래밍,3499.0,keymamo,웹 유지보수
당신의 아이디어를 안드로이드 앱으로 제작해 드립니다.,모바일,3500.0,KOMAT,앱
신속하고 정확하게 퍼블리싱해 드립니다.,홈페이지,3501.0,일삼사삼사공,웹 유지보수
"통계분석T검정,쌍체표본검정,회귀분석,ANOVA등을 드립니다.",데이터,3503.0,검도수학,데이터 전처리.분석.시각화
Django 서비스 AWS 환경에 배포를 도와 드립니다.,기타,3505.0,현민,기타
분양사이트 프랜차이즈 랜딩페이지 제작해 드립니다.,프로그래밍,3506.0,디자인핫쇼,웹 제작
"윈도우 응용프로그램 값싸고, 성실하게 만들어 드립니다.",프로그램,3507.0,소소소,기타
웹사이트 수정/개선/오류 를 빠르게 개발해 드립니다.,홈페이지,4767.0,러그포터,웹 유지보수
안드로이드 네이티브 앱 제작 해드립니다,모바일,3509.0,DeveloperWilson,앱
안드로이드 모든 앱 개발해 드립니다.,모바일,3510.0,androidPeace,앱
react 기반 퍼블리싱/프론트엔드 작업해 드립니다.,홈페이지,3511.0,Squarexit,웹 유지보수
에어드랍 홀더수 증가를 해 드립니다.,기타,3512.0,OMD,기타
"퍼블리싱 html,css,jquery 작업 해 드립니다.",홈페이지,3513.0,ejstudioK9,웹 유지보수
고객님만의 수익형 앱게임을 유니티 Unity로 제작해 드립니다.,모바일,3514.0,최강개발자,게임·AR·VR
맞춤형 Excel 제작해 드립니다.,프로그래밍,3515.0,멜코딩,웹 제작
논문통계 맞춤형통계 통계분석 도와 드립니다.,데이터,3516.0,stathelper,데이터 전처리.분석.시각화
RPA 기반 매크로 툴 제작해 드립니다.,프로그래밍,3517.0,스마트웨스트,프로그램 자동화
20년 이상의 경력으로 반응형 홈페이지를 제작해 드립니다.,홈페이지,3518.0,와이드웹,웹 제작
로딩이 느린 페이지 수정해 드립니다.,기타,3519.0,CYLJK,웹 유지보수
논문통계분석을 도와 드립니다.,데이터,3521.0,Aru,데이터 전처리.분석.시각화
워드프레스와 우커머스 기능 개선 및 버그 수정해 드립니다.,홈페이지,3522.0,WIXload,웹빌더
카페24 쇼핑몰 제작부터 노하우까지 전달해 드립니다.,커머스,3523.0,ProjectHenry,웹 제작
고객 중심의 모바일 앱 화면기획서를 작성해 드립니다.,모바일,3524.0,5minute,앱
Android Application 개발해 드립니다.,프로그래밍,3525.0,Junddao,웹 유지보수
"Android, iOS 모바일 앱 기능 및 버그 수정",모바일,3527.0,트레이서,앱
스쳐가는 고객을 붙잡을 수 있는 랜딩페이지를 제작해 드립니다.,프로그래밍,3528.0,천호인터내셔널,웹 제작
iOS 앱 유지보수 도와드립니다,모바일,3529.0,모건의iOS,앱
모든 웹사이트 원하시는 방향으로 크롤링해 드립니다.,데이터,3530.0,김명준wNJJ6K9,크롤링.스크래핑
"PHP 프로그램 유지보수 및 수정, 개발해 드립니다.",프로그램,3531.0,김명준wNJJ6K9,웹 유지보수
"웹 데이터 파싱, 크롤링해 드립니다.",데이터,3532.0,크롤링개발자,크롤링.스크래핑
깔끔하고 완성도 있는 퍼블리싱 제작해 드립니다.,홈페이지,3533.0,퍼블대디,웹 유지보수
윈도우 응용 프로그램 제작해드립니다.,프로그램,3534.0,elecbug,프로그램 유지보수
귀찮은 반복 작업을 끝내기 위한 간단한 윈도우 프로그램,프로그램,3535.0,SuccessFree,프로그램 자동화
컴퓨터 원격 윈도우 초기화 / 오피스 설치해 드립니다.,기타,3536.0,1인개발자,하드웨어·임베디드
윅스 아임웹 식스샵 크리에이터링크 로 홈페이지 제작해,홈페이지,3537.0,DY컴퍼니,웹빌더
디자인만 주시면 랜딩페이지 퍼블리싱 완성해 드립니다.,디자인,3538.0,유레카엔터프라이즈,웹 유지보수
최고 효율의 랜딩페이지 홈페이지 제작 개발해 드립니다.,홈페이지,3541.0,하룹,웹 제작
웹크롤링 / 대용량처리,데이터,3542.0,kapdolli,웹빌더
유해사이트 / 워닝 도메인 차단 해제 서비스,기타,3543.0,MakeCompany,기타
"카페 24 디자인소스 웹개발, 퍼블리싱 정확하고 빠르게",홈페이지,3544.0,맥포머스,웹 유지보수
웹 페이지 고민 중이시라면 주저 말고 연락 주세요.,홈페이지,3546.0,이머스immerse,웹빌더
네이티브 및 하이브리드 앱 개발 및 수정해드립니다.,모바일,3547.0,라시온,웹 유지보수
파이썬 기반의 업무효율 개선 및 시각화 프로그램개발,프로그램,3548.0,푸른나비393,코딩
오차범위 5px 이내의 반응형 퍼블리싱 해드립니다,홈페이지,3549.0,pgmt,웹 유지보수
"그누보드,PHP 기능, 서버이전 해드립니다",데이터,3550.0,규루리,서버.클라우드
안드로이드 디자인 및 오류수정해 드립니다.,디자인,3552.0,내꺼처럼개발,앱
"모든 웹사이트 버그 수정, 기능 개발해 드립니다.",홈페이지,3553.0,zeehastory,웹 유지보수
웹 프로그래머가 필요하신가요 좋은 파트너가 되어 드립니다.,홈페이지,3554.0,소울0817,웹빌더
독창적이고 대중적인 홈페이지를 만들어 드립니다.,홈페이지,3561.0,BTBONG,웹 제작
반응형 홈페이지 맞춤형 웹사이트 제작해 드립니다.,홈페이지,3562.0,그룹오브크리에이티브피플,웹 제작
랜딩페이지에 메일 서버 연동해 드립니다.,데이터,3565.0,BlueMakers,웹 제작
타블라 타불라 스크립트 설치 도와 드립니다.,기타,3572.0,개밥그릇,코딩
전문 개발자가 GTM 구글 애널리틱스 전자상거래 설치해 드립니다.,프로그래밍,3574.0,더볼트코퍼레이션,액셀.스프레드시트
"모두 홈페이지 퀄리티가 다른, 합리적인 modoo디자인",홈페이지,3575.0,나우나우nownow,웹 제작
주간계획표 위클리 플래너 엑셀 템플릿 드립니다.,데이터,3578.0,엑셀마왕,액셀.스프레드시트
ReactNative로 Android/iOS 앱 개발,모바일,3579.0,Sosofun,앱
각종 자동화 및 매크로 프로그램 만들어 드립니다.,프로그램,3580.0,뉴소프트,프로그램 자동화
수백개의 문서 종류 상관없이 pdf변환 드립니다.,데이터,4611.0,betterwork,기타
"최소한의 업무, 최선의 기획, 빠른 제작,만족의 서비스",기획,3582.0,세이브애드,직무직군
업무사무자동화 매크로 만들어 드립니다.,기타,3583.0,다박,프로그램 자동화
노션으로 온라인 글쓰기 모임 템플릿 만들어드립니다,기타,3584.0,누생누영,웹빌더
"데이터 라벨링, 작업후 검수까지해 드립니다.",데이터,3585.0,애니데이터,크롤링.스크래핑
임베디드AVR STM 아두이노 등 어플 웹 DB 연동해 드립니다.,UnReal,3587.0,임베디드펌웨어개발,하드웨어·임베디드
수익에 특화 되어있는 모바일 게임 개발해 드립니다.,프로그래밍,3588.0,RA2B,게임·AR·VR
자동매매 끝판왕 서버리스 매매 시스템 만들어 드립니다.,데이터,3591.0,bethev,프로그램 자동화
c# 프로그램 개발해 드립니다.,프로그램,3592.0,파란상어5142,프로그램 유지보수
원하는 페이지 크롤링을 이용해 데이터 수집해 드립니다.,데이터,3594.0,희인,크롤링.스크래핑
군인은 나라를 지키고 보안SSL 은 웹사이트를 지켜 드립니다.,홈페이지,3595.0,THECREB더크래브,정보.보안
"AWS 구축, 트러블슈팅, CICD 구성 등 해드려요",프로그래밍,3596.0,KokoaWorld,데이터 구매
원하시는 유니티 Unity 2D 게임 제작해 드립니다.,디자인,3597.0,사다새,게임·AR·VR
대표님의 아이디어를 빠르고 쉽게 기획서로 만들어 드립니다.,기획,3598.0,나루세,기타
고객님이 직접 운영할수 있는 맞춤 홈페이지 만들어 드립니다.,홈페이지,3601.0,DesignKim,웹 제작
스톤모두 홈페이지 제작 요청주시면 알아서 잘만들어 드립니다.,홈페이지,3603.0,stonemodoo,웹 제작
웹 제작 빠른 시일 내에 작업해 드립니다.,홈페이지,3605.0,꽃게는웹개발자,웹 제작
"크롤링, 업무 자동화해 드립니다.",데이터,3606.0,PlayNProvide,크롤링.스크래핑
웹사이트 개발 기능 추가 오류 수정 도와 드립니다.,홈페이지,3610.0,제스엔,웹 유지보수
WEB 반응형 퍼블리싱 작업 해드립니다.,홈페이지,3611.0,db퍼블,웹 유지보수
성능향상을 위한 최적의 쿼리 작성 및 튜닝 해 드립니다.,기타,3615.0,SanghoonLee72,데이터베이스
"고도몰,영카트,퍼스트몰 쇼핑몰 제작 및 튜닝해 드립니다",커머스,3616.0,sandmartin,웹 제작
시선을 땡기는 그래프 차트 만들어 드립니다.,기타,3617.0,아빠가들려주는데이터시각화,기타
예방의학과 의사의 통계분석 데이터가 없어도 분석해 드립니다.,데이터,3618.0,홍동의,데이터 전처리.분석.시각화
